;title;tag;date;text;is_question;id
135;;;2014. ju패n. 22. 23:19;Na패lunk, az SZTE-n a nem bentlako패knak, vagyis a beja패ro패knak nincs kolle패giumi di패j, hiszen tulajdonke패ppen szakkoliban is csak a rezsie패rt fizetsz.;False;5803558
136;;;2014. ju패l. 20. 22:37;"A beja패ro패knak nem kell fizetni. Egye패bke패nt az ELTE-hez tartozik 3-4 szakkoli:  [link] 

Ha bentlako패s vagy, azt hiszem, most 14 ezer ko팯ru팯l van havonta.";False;5803558
137;Szakkolle패giumba csak BA-s hallgato패k jelentkezhetnek?;;2018. jan. 21. 12:58;"Ha szeptemberto팲l kezdem meg MA-s tanulma패nyaimat az ELTE-BTK-n, akkor e패n ma패r nem jelentkezhrtrk pl. az Eo팯tvo팯s Collegiumba?
";True;9094868
138;Egyetem vagy szakkoli? ELTE/elte Bibo패-elte Illye패s;['egyetem', 'tova패bbtanula패s', 'ELTE', 'Illye패s Gyula', 'szakkolle패gium'];2017. jan. 9. 18:44;"Leginka패bb a pszicholo패gia e패rdekelne, e패s tala패lkoztam ezekkel az inte패zme패nyekkel az elte패n tu패l, egyre패szt nem ege패szen e패rtem, mit jelent, mie패rt jo패 a szakkolle패gium, ma패sre패szt az elte ""norma패l"" ke패pze패se패hez viszonyi패tva jobb/rosszabb, miben?
Kicsit o팯sszeszedetlen lett a ke패rde패sem, reme패lem aze패rt e패rtheto팲, elo팲re is ko팯szo팯no팯m a va패laszokat!
";True;8353923
139;;['egyetem', 'tova패bbtanula패s', 'ELTE', 'Illye패s Gyula', 'szakkolle패gium'];2017. jan. 10. 15:38;Ezek az inte패zme패nyek nem az elte패n tu패l vannak, hanem maga패nak az elte패nek a szakkoliai, azaz akkor nyerhetsz felve패telt, ha az adott szakkoli szakja패ra ja패rsz, a pszicholo패gia패hoz az Illye패s tartozik. Egyik szakkolinak sem vagyok tagja, de a hallotak alapja패n annyit tudok mondani, hogy ezek annyit e패rnek, amennyit kihozol belo팲lu팯k. O팯nteve패keny mu팯helyeket, szakko팯ro팯ket ki패na패lnak azoknak akik jobban el akarnak meru팯lni az adott ke패pze패si teru팯letben, hogy felke패szu팯ltebben keru팯ljenek ki a munkapiacra, eza패ltal elo팲nyt is nyerve. Le패nyege패ben ez az igaza패n elhivatottaknak egy leheto팲se패g.Vagyis nekem nagyja패bo패l ennyi jo팯tt le, aze패rt ezen informa패cio패kat ke패retik fenntarta패ssal kezelni, mert me패gegyszer, e패n nem vagyok szakkolis, de ha패tha kapsz va패laszt egy nem laikusto패l is.;False;8353923
140;"Mi a ku팯lo팯nbse패g egy sima egyetemi kolesz e패s egy
szakkolesz ko팯zo팯tt?";['egyetem', 'kolle패gium', 'szakkolle패gium'];2016. szept. 25. 18:42;;True;8123939
141;;['egyetem', 'kolle패gium', 'szakkolle패gium'];2016. szept. 25. 19:14;"A szakkolle패giumnak semmi ko팯ze a bennlaka패shoz. Az egy szakmai / tudoma패nyos mu팲hely, ""o팯nke패pzo팲 ko팯r"", ahol a hallgato패k legto팯bbszo팯r oktato패k mentori segi패tse패ge패vel) elo팲ada패sokat szerveznek, esetleg tansze패ki projektekben vagy egye패b, fakultati패v szakmai rendezve패nyeken vesznek re패szt.";False;8123939
142;"A ""szakkolle패gium"" pontosan mit takar? Valakinek vannak
tapasztalatai/e패lme패nyei/ba패rmi szakkolikkal kapcsolatban?";;2015. aug. 16. 14:05;;True;7126099
143;;;2015. aug. 16. 14:13;"elme패letileg hajto패sabb, elme패letileg elva패rja패k hogy plusz o패ra패kat vegye패l fel e패s elo팲ada패sokat tarts egy szu팲k ko팯zegnek / ma패s szakkolisoknak, vagy hasonlo패k

igaza패bo패l nem tudom, csak hallottam
de olyanro패l is hallottam aki tag e패s nem csina패lt semmit csak sunyi mo패don e패lvezte hogy nyugisabb helyen lakhat mint egy a패tllag kolis...";False;7126099
144;ELTE Illye패s Sa패ndor Szakkolle패giumro패l tapasztalatok?;['egyetem', 'ELTE', 'szakkolle패gium', 'illye패s sa패ndor'];febr. 3. 09:55;"Ba패rmi e패rdekelne. Milyen e패lme패ny, hasznosnak tala패lta패tok-e, aja패nlana패tok-e?
A패tbo팯nge패sztem mindent, ami csak a honlapjukon van, e패s nagyon vonz, hogy megpro패ba패ljak felve패telizni augusztusban, de e패rdekelne ne패ha패ny szeme패lyes tapasztalat is.
";True;10945600
145;;['egyetem', 'ELTE', 'szakkolle패gium', 'illye패s sa패ndor'];febr. 3. 12:14;E패n tagja vagyok, i패rj nyugodtan aka패r priva패tot is. Ba패rmiben tudok segi패teni. Szeme패ly szerint nagyon szeretem.;False;10945600
146;"PTE-ETK-s hallgato패k? Ne패ztem a kolle패giumokat e패s feltu팲nt
hogy az etk-s koli a laterum. Bo팲vebben lenn";['egyetem', 'kolle패gium', 'Pe패cs', 'gyo패gytorna패sz', 'PTE', 'ETK', 'szakkolle패gium'];2019. a패pr. 28. 21:57;"(Gyo패gytorna패sz leszek szeptemberto팲l pe패csett) e패s e패rdekel hogy ro팯gto팯n mindenkit, a go패lya패kat is oda rakja패k e kive패tel ne패lku팯l mert az szakkoli? K. szi elo팲re is az info패t aka패rmelyik pe패csi koliro패l.
";True;9861749
147;;['egyetem', 'kolle패gium', 'Pe패cs', 'gyo패gytorna패sz', 'PTE', 'ETK', 'szakkolle패gium'];2019. a패pr. 28. 22:06;Az kimaradt hogy  aze패rt  ke패rdezem  mert messze van mindento팲l  e패s nem szivesen menne패k oda;False;9861749
148;;['egyetem', 'kolle패gium', 'Pe패cs', 'gyo패gytorna패sz', 'PTE', 'ETK', 'szakkolle패gium'];2019. ma패j. 6. 02:19;"Szia! E패n is Pe패csre ke패szu팯lo팯k gyo패gytorna패sz szakra, szo패val ha minden jo패l megy szakta패rsak leszu팯nk. :)

A ke패rde패sre sajnos va패laszolni nem tudok, de ez engem is nagyon e패rdekelne. Ha valaki rendelkezik e패rdemi informa패cio패val a te패ma패val kapcsolatban, az legyen kedves ne tartsa maga패ban. :* :)";False;9861749
149;;['egyetem', 'kolle패gium', 'Pe패cs', 'gyo패gytorna패sz', 'PTE', 'ETK', 'szakkolle패gium'];2019. ma패j. 7. 11:46;"A laterumban 6 a패gyas szoba패k vannak kb fe패l o패ra busszal az egyetemto팲l, nem aja패nlom, igaz sokaknak ez is jobb volt a semmine패l. Igaz ez hivatalosan a kar kolija, de nem jelent semmit, ha teheted ma패sik koliba jelentkezz! Igaz sokan szeretik, de szerintem kell ehhez nagy empa패tia, hogy 6 emberrel legye패l folyton, meg a패lli패to패lag nincs a legjobb a패llapotban a koli, igaz la패tni nem la패ttam, csak mese패ltek ro패la sokat csoportta패rsaim. Az ETK az utolso패 amire gondol a PTE, szo패val eze패rt ilyen a szerveze패s... tu패l sok poziti패v dolgot ne va패rj az egyetemto팲l ilyen te패ren... max ha erasmuson vagy, mert belo팲lu팯k jo팯n a pe패nz游뱎 e패n ide패n va패ltok egyetemet, e패n a Sza패nto패ba ja패rtam, azt aja패nlom a leginka패bb, igaz oda nagyon magas pontsza패m kell, mert oda a legnehezebb a bejuta패s, e패rdemes kisza패molnod, hogy mennyi pontod lenne (szocia패lis+tanulma패nyi), e패s ha fel is vesznek, uta패na is az ETK dia패kjainak kell minden e패vben a legto팯bb pont, ami패g egy mu팲ve패szetisnek kb 25 pont ele패g a kolihoz, addig egy etksnak 40 pont kell minden e패vben hogy legala패bb koliba ja패rhasson... a neten ne패zz uta패na a pontsza패mi패ta패snak e패s az alapja패n gondold a패t me패gegyszer, e패s ha sok pontod lesz, akkor semmike패pp se menj a laterumba hanem csak a Sza패nto패 vagy a Boszi, ott 2 a패gyas szoba패k vannak e패s blokkos rendszer van, ami olyan mint egy albe패rlet, annyi a negati패vum, hogy a Sza패nto패 tele van ku팯flo팯ldivel, a Bosziban meg egy diszko패 u팯zemel alul.
Bocsi a negati패v hangve패tele패rt, de nekem nagy csalo패da패s volt az ege패sz egyetem游땟";False;9861749
150;"Aki jelentkezett ide패n az MCC-be, kapott ma패r emailt, hogy
felvette패k vagy nem?";['szakkolle패gium', 'MCC'];2020. ma패j. 13. 16:13;;True;10480176
151;"Ma패rton A패ron Szakkolle패giumba Bp-n lehet e패jjelre vende패get
vinni?";;2015. okt. 18. 23:17;"E패s ha igen,elo팲re bekell jelenteni,vagy kell e패rte fizetni?
";True;7285881
152;Jedlik A패nyos Szakkolle패gium milyen Veszpre패mben?;['egyetem', 'kolle패gium', 'Veszpre패m', 'Pannon Egyetem'];2019. ju패l. 27. 19:01;"Mennyire jo패 a kolesz? Mege패ri ode menni, vagy inka패bb a Magister?
";True;10007106
153;;['egyetem', 'kolle패gium', 'Veszpre패m', 'Pannon Egyetem'];2019. ju패l. 27. 20:45;Keru팯ld, amilyen messziro팲l csak tudod!!!;False;10007106
154;;['egyetem', 'kolle패gium', 'Veszpre패m', 'Pannon Egyetem'];2019. ju패l. 27. 20:59;Mie패rt? Nem jo패?;False;10007106
155;;['egyetem', 'kolle패gium', 'Veszpre패m', 'Pannon Egyetem'];2019. aug. 13. 12:32;Jedlikes vagyok, e패n szeretem;False;10007106
156;;['egyetem', 'kolle패gium', 'Veszpre패m', 'Pannon Egyetem'];2019. aug. 26. 20:43;"Ha패t ha ku팯lo팯n elo팲ada패sokkal akarsz me패g szo패rakozni az elo팲ada패sok mellett, meg kisebb, re패gebbi koliban lakni, akkor nyugodtan menj oda :D de ha inka패bb a ""norma패lisabb"" kolit valasztana패d, akkor Magi";False;10007106
157;;['egyetem', 'kolle패gium', 'Veszpre패m', 'Pannon Egyetem'];2020. a패pr. 21. 12:41;"E패n fe패le패vig jedlikes voltam, de nem tetszett. Minden he패ten van valamilyen ko팯telezo팲 jellegu팲 program, ami he패tko팯znap van(a패ltala패ban kedd este 8). Engem ez idegesi패tett, meg mivel nincsenek annyira sokan, nekem nehezen ment a beilleszkede패s is, mivel akik ott vannak kb ismerik ma패r egyma패st, e패s ha picit za패rko패zottabb vagy e패s nem me패sz a ""veze패rekkel"" bulizni akkor kiesel a ko팯rbo팲l, e패s magukto패l nem nagyon hi패vnak.";False;10007106
158;"NKE a패llamtudoma패nyi szaka패ro패l ve패leme패ny? Illetve van ott
valamilyen szakkolle패gium?";['egyetem', 'tanula패s', 'oktata패s', 'ko팯zigazgata패s', 'NKE', 'szakkolle패gium', 'a패llamtudoma패ny'];2019. jan. 6. 22:30;"Felve패teli elo팲tt a패llok, e패s e패rdeklo팲dne패k hogy a Nemzeti Ko팯zszolga패lati Egyetem a패llamtudoma패nyi szaka패nak mik az elo팲nyei/ha패tra패nyai? Mennyivel jobb, mint egy ko팯zigazgata패s-szervezo팲i? Mege패ri ideja패rni? Aki esetleg tud a szakkolijukro패l, mese패lne egy kicsit bo팲vebben, hogy mik a felte패telei a bekeru팯le패snek, hol lehet jelentkezni oda? Ko팯szo팯no팯m :)
";True;9685402
159;;['egyetem', 'tanula패s', 'oktata패s', 'ko팯zigazgata패s', 'NKE', 'szakkolle패gium', 'a패llamtudoma패ny'];2019. jan. 7. 13:25;"Szakmaisa패ga패ra ige패nyes, kritikus gondolkoza패ssal rendelkezo팲 szeme패ly, messzire elkeru팯li ezt az egyetemet.
Amennyibe hosszu패 a nyelved, e패s ke패pes vagy azonosulni az orsza패gban jelenleg folyo패 dolgokkal, - amik csak rosszabbak lesznek - akkor jo패 helyen keresge패lsz.

Egy volt NKE-s az emli패tett szakro패l.";False;9685402
160;;['egyetem', 'tanula패s', 'oktata패s', 'ko팯zigazgata패s', 'NKE', 'szakkolle패gium', 'a패llamtudoma패ny'];2019. jan. 7. 20:14;Ko팯szo팯no팯m!!;False;9685402
161;;['egyetem', 'tanula패s', 'oktata패s', 'ko팯zigazgata패s', 'NKE', 'szakkolle패gium', 'a패llamtudoma패ny'];2019. jan. 7. 21:46;Elozo evben nagyon sokat ragodtam az NKE allamtudomanyin. Ha erzed hogy ezt szeretned csinalni jelentkezz oda DE! vedd szamitasba hogy igenis allast kell foglalnod majd egyszer az eletedben es meg lesz kotve jocskan a kezed. Ezzel a szakkal nagyon-nagyon magyarorszaghoz leszel kotve. Es a feljebbbjutas tenyleg csak ismeretseg es nyalas, gyomor kerdese. En vegul lecsusztam rola, es a masodik helyen egy teljesen mas iranyt jeloltem be, nem bantam meg mert amit most tanulok azzal kulfoldon egy jobb kornyezetben ezerszer jobban fogom magam erezni.;False;9685402
162;;['egyetem', 'tanula패s', 'oktata패s', 'ko팯zigazgata패s', 'NKE', 'szakkolle패gium', 'a패llamtudoma패ny'];2019. jan. 7. 22:01;I패rtam priva패t.;False;9685402
163;;['egyetem', 'tanula패s', 'oktata패s', 'ko팯zigazgata패s', 'NKE', 'szakkolle패gium', 'a패llamtudoma패ny'];2019. jan. 13. 21:24;"Nagyon idegesi패to팲 szerintem, hogy a legto팯bb ember mindenfe패le informa패cio패 vagy ha패tte패rtuda패s ne패lku팯l ha hall valamit erro팲l az egyetemro팲l akkor ro팯gto팯n a korma패nyhoz meg a politika패hoz ko팯ti e패s azt hiszi, hogy fideszeseket ke패peznek akiknek a패lla패st kell foglalni a politika패ban. Ez lenne az, amit ezeknek az embereknek fel kellene fognia e패s kicsit uta패naolvasni, hogy mit is tanulnak itt pontosan a dia패kok. Ela패rulom, hogy mindenfajta bea패lli패tottsa패gto패l fu팯ggetlenu팯l MINDIG szu팯kse패g lesz ko팯ztisztivelo팲kre!!:)) Ez nem a korma패ny egyeteme, hanem egy egyetem ,mint mindegyik ma패s Ami szomoru패, hogy ma패r a ""volt nke-sek"" is ilyeneket i패rnak ne패vtelenu팯l, pedig mivel jo패magam is oda ja패rok ela패rulom, hogy senki soha nem emli패tett me패g semmilyen olyat, hogy nekem most igenis korma패nypa패rtinak kell lennem, mert az jo패. :)";False;9685402
164;;['egyetem', 'tanula패s', 'oktata패s', 'ko팯zigazgata패s', 'NKE', 'szakkolle패gium', 'a패llamtudoma패ny'];2019. jan. 23. 00:12;"utolsonak uzennem, hogy akkor az egyetemen kivul is szemleld az orszagot es lass ne csak nezz. Ma magyarorszagon ha egy koztisztviselo kritizalja a kormanyt vagy a miniszterelnokot es a kornyezetet az nem fog a poziciojaban maradni sokat. Es az nke-n is igaz ez.
Koztisztviselo mindig is kelleni fog, ez igaz, de aki a velemenyet igenis ki szereti fejezni annak meg kell gondolnia hogy magyarorszagon olyan pozicioban akar e dolgozni ami az allamhoz koti. Nem magaval az NKE-mel van baj. Ez magabol a rendszerbol jon.

Ismerosom hivatalvezeto, a dolgozoknak a valasztasok elott hazalni kellett a telepuleseken, illetve ki volt adni hogy tuloraba maradni kell telefonalgatni. SENKI nem mondott nemet, mindenki feltette az allasat. Az allamigazgatas mindig is egy biztos allast jelent bar fillerekert dolgoznak a hivatalokban. Aki a miniszteriumokba keszul annak KOTELESSEGE benyalnia magat, es az tok8 hogy jobb vagy baloldali. Gondolom mindenki sejti, hogy ha itt lesz kormanyvaltas akkor az OSSZES vezetot/kozepvez., fontosabb beosztasban dolgozot le fognak cserelni, ezek azok a poziciok ahol igazan jol lehet keresni (nem a jarasiban fogsz meggazdagodni).


En az allamigazgatast azert akartam valasztani mert lattam benne potencialt, es meg mindig latok is! Ez egy jol osszerakott szak. De 2.5 ev angliai elet utan arra is ra kellett jonnom, hogy ott jo elni ahol jol is erzed magad, ahol szabad vagy. Ezert nem bantam meg hogy masik szakra mentem nem az NKE-re, mert igy diplomaval tudok kimenni.

Jottek PM-ek, itt valaszolok:
kozepsuli utan kimentem angliaba dolgozni utana visszajottem tanulni
Elso helyre NKE allamigazgatast valasztottam. Mar a felv.beszelgetesnel nagyon kedvesek voltak, a 2 tanar kozul az egyik meg is jegyezte hogy orulni fog ha bejutok. Hat nem jutottam es el is voltam keseredve.Ez volt elozo evben, 2018.
Azota sok minden valtozott es tenyleg nem bantam meg, hogy nem azt az utat jarom.
Masodik helyre teljesen ellentetes iranyt valasztottam, muszaki szakra mentem. Hogy miert jo? Felelmetesen sok lehetoseged van, mar BSC-vel jol tudsz keresni akar itthon is (netto 250 mar mindenhol megvan kezdokent, ha meg nincs ott kell hagyni), kulfoldon ennek a 6x-osa megvan. Es lehet valogatni van atjaras, kinek mi fekszik. Logisztikai, epitesz, gazdasagi/muszaki menedzser, villamos, gepesz stb. aki jot valaszt annak a masod/harmaddiplomaja is siman megvan mert csomo atfedes van. Mesterrel meg teljesen jo lesz de nelkule is. Es meg atlagbol sem annira sok mint mashol mert ez evben 2,75 utan 3.0. (ami amugy szivas, mert kell a kredit is melle +36). De a bolcsoeszeknek meg a muveszeteseknek mar most 3.25 es utana 3.5 + 36 kredit ha nincs meg mennek koltsegesre. Az NKE-en nem tom hogy mennyi lesz a kotelezo mert iden szeptembertol emelik megint azt mar irtam mennyire.

Kb ennyi kicsit kusza, mar eleg este van.";False;9685402
165;Az ELTE패-n lehet egyszerre to팯bb szakkoliba jelentkezni?;['ELTE', 'szakkolle패gium'];2016. aug. 4. 12:24;"Az Eo팯tvo팯s Collegiumba szeretne패k igaza패bo패l menni, de nem vagyok biztos abban, hogy felvesznek. La패ttam, hogy van TTK-s szakkoli is, az is e패rdekelne, e패s tala패n to팯bb ese패lyem is lenne oda bejutni. Van erre leheto팲se패g?
";True;7997061
166;;['ELTE', 'szakkolle패gium'];2016. aug. 5. 08:18;Jelentkezhetsz to팯bbe, e패s mindketto팲nek tagja is lehetsz, ha esetleg u패gy alakul. :);False;7997061
167;;['ELTE', 'szakkolle패gium'];2016. aug. 5. 10:47;Ko팯szo팯no팯m sze패pen! :);False;7997061
168;Szegedike패nt lehetek egyetemen kolle패gista Szegeden (SZTE)?;['Szeged', 'kolle패gium', 'SZTE', 'SZTE TTIK', 'Eo팯tvo팯s Lo패ra패nd Szakkolle패gium'];2017. aug. 26. 23:12;"SZTE TTIK info팲ra menne패k, de szeretne패k bekeru팯lni az Eo팯tvo팯sbe. Lehetse패ges ez? Ha igen, mi alapja패n? Ha 450 fo팯lto팯tt lesz a felve패teli pontsza패mom, akkor tanulma패nyi pontok alapja패n felvesznek, me패g ha helyi is vagyok?
";True;8826614
169;;['Szeged', 'kolle패gium', 'SZTE', 'SZTE TTIK', 'Eo팯tvo팯s Lo패ra패nd Szakkolle패gium'];2017. aug. 26. 23:22;Kizart, ha csak nincs valami csaladi problema a hatterben.;False;8826614
170;;['Szeged', 'kolle패gium', 'SZTE', 'SZTE TTIK', 'Eo팯tvo팯s Lo패ra패nd Szakkolle패gium'];2017. aug. 26. 23:42;Mie패rt nem jelentkezel ku팯lso팲s tagnak? Egye패bke패nt azt hiszem, frissen felvettke패nt csak a ta패borukba tudsz pa패lya패zni, ahonnan lehet, hogy felaja패nlanak tagsa패got, a felve패teli pontsza패moddal o팯nmaga패ban nem.;False;8826614
171;;['Szeged', 'kolle패gium', 'SZTE', 'SZTE TTIK', 'Eo팯tvo팯s Lo패ra패nd Szakkolle패gium'];2017. aug. 26. 23:51;Nincs valami rokonod ma패sik va패rosbol? A패t lehetne iratnod magad, nagyon sokan csina패lja패k (ba패r o팯k o팯szto팯ndij miatt).;False;8826614
172;;['Szeged', 'kolle패gium', 'SZTE', 'SZTE TTIK', 'Eo팯tvo팯s Lo패ra패nd Szakkolle패gium'];2017. aug. 27. 01:42;"Azoknak az egye패rtelmu팲en nem SZTE-s va패laszolo패knak i패rok, akik szocia패lis helyzetro팲l besze패ltek; az Eo팯tvo팯s szakkolle패gium, teha패t nem a szocia패lis helyzet, hanem a szakmai e패s tanulma패nyi eredme패nyeid do팯ntenek a bekeru팯le패sro팲l.";False;8826614
173;"Valakinek valami tapasztalata a Szombathelyi
: II. Ja패nos Pa패l Katolikus Kolle패gium e패s
Szakkolle패gium-ro패l?
Ko팯zo팯sse패g?
Emberek?
Programok?
Ismero팲so팯k besza패molo패ja?
ba패rmi?";['tova패bbtanula패s', 'gimna패zium', 'kolle패gium', 'ko팯lto팯ze패s', 'Szombathely', 'tapasztalat'];2020. ju패n. 27. 15:55;"Ide tervezem menni koliba :)
To팯bbek ko팯zo팯tt mert ko팯zel van a kiszemelt Gimi-hez ,meg mert Google maps-en ele패g jo패l e패rte패kelte패k XD.

nem tudok valami sokat ro패la, az oldalukon sincs kb semmi.

Ke패rlek a ke패rde패sre va패laszoljatok, nem e패rdekelnek ma패s kolinak az adatai csak ennek.

A jo패 va패laszokat elo팲re is megko팯szo팯no팯m e패s jutalmazom, e패s le패gyszi패ves i패rjatok mine패l to팯bbet
";True;10562722
174;;['tova패bbtanula패s', 'gimna패zium', 'kolle패gium', 'ko팯lto팯ze패s', 'Szombathely', 'tapasztalat'];2020. ju패n. 29. 15:13;melyik suliba jelentkezte패l?;False;10562722
175;;['tova패bbtanula패s', 'gimna패zium', 'kolle패gium', 'ko팯lto팯ze패s', 'Szombathely', 'tapasztalat'];2020. ju패n. 29. 16:14;"Me패g nem jelentkeztem
majd a Nagy Lakosra gondoltam";False;10562722
176;;['tova패bbtanula패s', 'gimna패zium', 'kolle패gium', 'ko팯lto팯ze패s', 'Szombathely', 'tapasztalat'];2020. ju패n. 29. 16:14;*Nagy Lajos;False;10562722
177;"A Rajk La패szlo패 Szakkolle패giumro패l mit lehet, mit e패rdemes
tudni?";['egyetem', 'felve패teli', 'kolle패gium', 'Corvinus', 'ko팯zgazda패sz', 'mesterszak', 'alapszak', 'szakkolle패gium'];2013. aug. 22. 20:19;"Nehe패z bekeru팯lni? Milyen ti패pusu패 embereknek aja패nlott? Mennyire megterhelo팲? Mimyen ott lakni? Miben ad leginka패bb pluszt? Ba패rmilyen info패nak o팯ru팯lo팯k!
";True;4751686
178;;['egyetem', 'felve패teli', 'kolle패gium', 'Corvinus', 'ko팯zgazda패sz', 'mesterszak', 'alapszak', 'szakkolle패gium'];2013. aug. 22. 20:30;A neve패bo팲l i패te패lve komcsiknak aja패nlott. Nagyon durva, hogy kolle패giumot neveztek el ro패la.;False;4751686
179;"Adott egyetem szakkolle패giuma패ba ma패sik egyetem
hallgato패jake패nt is lehet jelentkezni?";;2018. febr. 3. 23:03;"Corvinus-GyDSz e패rdekelne, de e패n az ELTE mesterszakos hallgato패ja leszek szeptemberto팲l. A jelentkeze패si felte패telek ko팯zo팯tt nem i패rta패k, higy csak Corvinus-os hallgato패kat va패rnak, de lehet, ez evidens.

Valaki tudja, hogy mu팲ko팯dik az ilyesmi? Ko팯szi elo팲re is! :)
";True;9121813
180;;;2018. febr. 4. 08:42;"A legto팯bb szakkole패giumba szivesen va패rja패k ma패s egyetemek dia패kjait is, e패s kis uta패nna ja패ra패ssal, ugyne패zem ez a GyDSz ne패l sincs ma패ske패p, egy kis re패szlet a weboldalukro패l: ""A jelenleg 70 fo팲s tagsa패gunk to팯bbse패ge a Budapesti Corvinus Egyetem Nemzetko팯zi Tanulma패nyok ke패pze패se패ben re패sztvevo팲 hallgato패k, de ma패ra ma패s egyetemek dia패kjaival is bo팲vu팯lt Szakkolle패giumunk le패tsza패ma.""
Plusz a felve패teli nyomtatva패nyon sem ve패letlenu팯l szerepel az hogy melyik egyetemre ja패rsz :)";False;9121813
181;;;2018. febr. 4. 10:19;"Nagyon sze패pen ko팯szo팯no팯m a segi패tse패get! :)
E패s akkor az sem akada패ly, hogy nem alapszakoske패t jelentkezem?";False;9121813
182;"Mi a ve패leme패nyetek a Pannon egyetem Jedlik A패nyos
szakkolle패giuma패ro패l?";['Pannon Egyetem', 'Jedlik', 'szakkolle패gium'];2014. aug. 3. 20:42;"Nehe패z a bejuta패s?
A bent marada패s gondolom nehe패z, de mege패ri ott lakni?
A szoba패k jo패 felszereltse패gu팲ek?

A va패laszokat elo팲re is ko팯szo팯no팯m!
";True;5957058
183;;['Pannon Egyetem', 'Jedlik', 'szakkolle패gium'];2014. aug. 3. 21:57;"




Sajnos kicsit le kell to팯rjelek. A koli az egyetem egyik legrosszabban felszerelt kolija. Festeni nem szoktak, az ablakok igen re패giek, az ajto패bo패l kiesnek a za패rak, az o팯sszesen hat zuhanyzo패bo패l a패ltala패ban csak ketto팲 mu팲ko팯dik. Az a패ra ennek megfelelo팲en a legolcso패bb katego패ria패ban van.

A bentmarada패s e패s a bejuta패s sem tekintheto팲  ""nehe패znek"". Ha kapta패l meghi패vo패t a felve패telire, elmehetsz, elbesze패lgetsz velu팯k, e패s ha szimpatikus (!!!) vagy, felvesznek. Nincs ebben semmi tanulma패nyi elva패ra패s - ha kapta패l meghi패vo패t, a패tmente패l a szita패n, onnanto패l leginka패bb szimpa패tia ke패rde패se. Bent akkor maradsz, ha minden e패vben leadsz egy szakmai munka패t. Mondanom sem kell, ez a felso팲bbe패veseknek nem megterhelo팲 dolog, az elso팲so팯k viszont meg-megszakadnak bele. Emiatt van, hogy olyan szenior volt nemre패g, akit majdnem kitettek az egytemro팲l is, mivel nem voltak jo패k a tanulma패nyai, de leadta a munka패t, ke패sz. E패s pont emiatt a legto팯bb elso팲s, aki odakeru팯l, megba패nja, e패s otthagyja - egy elso팲snek rendki패vu팯l nagy ero팲feszi패te패s egy dolgozat i패ra패sa. Nem ele패g, hogy meg kell sozkni az egyetemi e패letet, ilyennel is kell b*szakodni.

A jo패 oldalt is ki kell emelnem azonban: a koliban remek a ko팯zo팯sse패g. Mindenki mindenkit ismer. Ahogy egy Jedlikes ismero팲so팯m megfogalmazta anno패, ""itt nem az a pletyka, hogy ki kivel feku팯dt le, hanem hogy ki kivel nem"".

O팯sszesse패ge패ben a Pannon Egyetem hallgato패inak nagyre패sze (ma패r aki tud ro패la) ki패nosan nevetse패gesnek tartja, hogy a Jedlik szakkolinak hi패vja maga패t, mikor minima패lis ko팯vetelme패nnyel minden hu팯lye패t felvesznek, e패s benn is marad. A ko팯zo팯sse패g viszont rendki패vu팯l ero팲s.";False;5957058
