;title;tag;date;text;is_question;id
362;;['Oxford', 'Cambridge'];2018. ma패j. 24. 18:34;"Oxford e패s Cambridge collegiate universityk, ezeket az egyetemeket a college-ok alapi패totta패k. Olyanok, mint a Harry Potterben a ha패zak (onnan vette az o팯tletet Rowling), csak nem ne패gy van, hanem 31, mindegyiknek saja패t szeme패lyise패ggel. A tanula패son tu패li e패letedet gyakorlatilag a colege hata패rozza meg (pe패nz, e패tkeze패s, sza패lla패s, sport, o패vszer stb.).

Ne패ha패ny egyetem (pl. Durham az 1800-as e패vekben) megpro패ba패lta lema패solni a rendszert (a college-ok ko팯zo팯tti versenge패snek van egy poziti패v hata패sa), de ele패g mesterke패lt lett, nem igaza패n ko팯to팲dnek az emberek a college-ukhoz.

A ko팯znyelvi brit angolban a college gimna패ziumot jelent. Ezzel egyu팯tt vannak olyan egyetemek, amik a mai napig college-nak hi패vja패k magukat to팯rte패nelmi okokbo패l (King's College London, Trinity College Dublin).

Az amerikai angolban fo팲iskola패t jelent (szi패nvonala패ban a universityk alatt), szo패val ha egy amerikai college-ot ve패gzett, az egyetemi ve패gzettse패get jelent.

Magyar megfelelo팲je nem igaza패n van.";False;9161975
363;;['Oxford', 'Cambridge'];2018. okt. 18. 22:34;"A college tobb szintu kepzest is ajanl, van egyetemi is. Pl HND (egyetem elso 2 evenek felel meg) elvegzese utan egy rendes egyetem 3. evere lehet ugrai es diplomat kapni 1 ev utan.
Level 3, az az A levelnek felel meg, alatta meg sokkal alacsonyabb szintek is vannak, entry level 1-3, level 1, level 2.";False;9161975
364;Egyetemen ga패z, ha nem veszek re패szt ezekben?;['egyetem', 'tanula패s', 'tana패r', 'TDK', 'hallgato패', 'szakkolle패gium'];dec. 4. 13:33;"Osztatlan mesterke패pze패sen vagyok, ege패sz jo패 a패tlagaim szoktak lenni, de valahogy nem e패rzem a szorgalmat arra, hogy nekikezdjek egy TDK-nak, illetve arra sem, hogy jelentkezzek valami szakkolle패giumba. Az e패vfolyamunkbo패l pa패ran csina패lja패k ezt, de o팲szinte leszek, nem tudom hogy mie패rt.

Alapbo패l sok ta패rgyam van fe패le패venke패nt, (minimum 15 tanta패rgy) e패s e패n ezeket bo팲se패gesen ele패gnek e패rzem ezeket. Az egyik adjunktus elo팲zo팲 fe패le패vben felaja패nlotta, hogyha TDK-zni akarunk, akkor szi패vesen segi패tene benne, mert bennem van annyi szorgalom meg tehetse패g, hogy nekia패lljak egy ilyennek, de engem egya패ltala패n nem e패rdekel ez az ege패sz, csak le akarok diploma패zni, e패s uta패na elmenni tani패tani, nem szeretne패k ittmaradni az egyetemen phd ke패pze패sen.

Ga패z ez a hozza패a패lla패s a re패szemro팲l?
";True;10830694
365;;['egyetem', 'tanula패s', 'tana패r', 'TDK', 'hallgato패', 'szakkolle패gium'];dec. 4. 13:38;Nem ga패z. Ha nem akarod csina패lni, akkor ne csina패ld, nem ko팯telezo팲. Nyilva패n az adjunktus sajna패lja, de ha nem e패rzel ra패 motiva패cio패t, akkor az a saja패t do팯nte패sed.;False;10830694
366;;['egyetem', 'tanula패s', 'tana패r', 'TDK', 'hallgato패', 'szakkolle패gium'];dec. 4. 14:02;Nem ga패z, ez csak egy plusz leheto팲se패g. Nyilva패n egy o팯ne패letrajzban jo패l mutat, ha la패tja a munka패ltato패, hogy ilyen me패lyse패gekig belemente패l a tanulma패nyaid szakmai re패sze패be, e패s ha jo패 sikeru팯l, akkor a szakdolgozat i패ra패sa패t is megko팯nnyi패ti. De ez csak egy leheto팲se패g, ha nem e패rzed ra패 a ke패sztete패st e패s motiva패cio패t, akkor felesleges belekezdeni, u패gysem fogsz olyan eredme패nyt i패gy ele패rni, amivel tudsz is kezdeni valamit.;False;10830694
367;;['egyetem', 'tanula패s', 'tana패r', 'TDK', 'hallgato패', 'szakkolle패gium'];dec. 4. 14:04;Ko팯szi a va패laszokat!;False;10830694
368;;['egyetem', 'tanula패s', 'tana패r', 'TDK', 'hallgato패', 'szakkolle패gium'];dec. 4. 15:47;1-es vagyok. Aze패rt az mekkora poe패n lenne, ha kideru팯lne,hogy az e패n hallgato패m vagy (szakkolle패giumot vezetek e패s minden ma패s is passzol, amit i패rta패l) :DDD;False;10830694
369;;['egyetem', 'tanula패s', 'tana패r', 'TDK', 'hallgato패', 'szakkolle패gium'];dec. 4. 16:54;DE-BTK? :|;False;10830694
370;;['egyetem', 'tanula패s', 'tana패r', 'TDK', 'hallgato패', 'szakkolle패gium'];dec. 4. 17:04;Nem :) egye패bke패nt az se lenne gond. :);False;10830694
371;;['egyetem', 'tanula패s', 'tana패r', 'TDK', 'hallgato패', 'szakkolle패gium'];dec. 8. 13:14;Egya패ltala패n nem ga패z. Egyetemen ma패r senki nem ne패zi e패s senkit nem is e패rdekel, hogy mit hogyan csina패lsz vagy e패pp nem csina패lsz :D Mellesleg bo팲ven ele패g szerintem a tanula패sra odafigyelni, nekem legala패bbis biztos nem lenne ilyenekre ido팲m, se energia패m.;False;10830694
372;"Corvinuson lehet egyszerre to팯bb szakkolle패gium tagja패nak is
lenni?";;2011. ma패rc. 19. 02:58;;True;1640470
373;;;2011. ma패rc. 19. 06:05;"Szerintem nem
Egy nem ele패g?";False;1640470
374;;;2011. ma패rc. 19. 11:47;"Abszolu패t nem.
Amu패gy szerintem is ele패g egy...";False;1640470
375;Hogyan van a szakkolle패giumba valo패 jelentkeze패s?;['Budapest', 'kolle패gium', 'fo팯ldrajz', 'Pest', 'ELTE', 'TTK', 'Buda', 'ELTE TTK', 'szakkolle패gium'];2020. jan. 17. 19:53;"Az ELTE TTK fo팯ldrajz szaka패ra szeretne패k menni e패s szakkolle패giumba. Ha jo패l tudom, az Eo팯tvo팯s Jo패zsef e패s a Bolyai ko팯zo팯tt va패laszthatok. De ezekre mikor van leheto팲se패g jelentkezni,  felvi.hu-n a sulira valo패 jelentkeze패skor vagy akkor amikor kideru팯lt, hogy felvettek e vagy sem. Tudom, hogy nehezebb szakkoliba bejutni, mint ""sima패ba"" mert ott van valami szo패beli fe패le is (?), szo패val valami plusz de ezt se tudom pontosan.

A va패laszokat elo팲re is ko팯szo팯no팯m, illetve ha van valami ve패leme패ny/e패lme패ny/tapasztalat az is jo팯het! :)
";True;10277439
376;;['Budapest', 'kolle패gium', 'fo팯ldrajz', 'Pest', 'ELTE', 'TTK', 'Buda', 'ELTE TTK', 'szakkolle패gium'];2020. a패pr. 21. 00:39;A honlapjaikon minden bizonnyal megtala패lod a felve패teli menete패t, ez szakkolikke패nt elte패ro팲 szokott lenni, de a패ltala패ban valamilyen i패ra패sbeli, e패s szo패beli fordulo패 mindenhol van. Jelentkeze패si hata패rido팲 is mindenhol ma패s, sok szakkoliba csak akkor tudsz majd jelentkezni ha ma패r felvettek egyetemre, de van ahova ma패r most tavasszal tudsz jelentkezni, e패s akkor ma패r szeptemberto팲l beko팯lto팯zni. Legjobb ha a honlapokon/Facebook oldakon ta패je패kozo패dsz, de e패rdemes tudnod, hogy a szakkolik aze패rt to팯bbro팲l szo패lnak mint bennlaka패s (egy a패ltala패ban szockolina패l sokkal jobb helyen).;False;10277439
377;Szakkollegium mellett mennyi isotok van?;['szakkolle패gium'];2015. ma패j. 10. 22:45;;True;6844580
378;;['szakkolle패gium'];2015. ma패j. 10. 22:46;Isotok=idotok, bocsi.;False;6844580
379;;['szakkolle패gium'];2015. ma패j. 10. 23:49;Nekem van. Te do팯nto팯d el mennyire akarod kihaszna패lni.;False;6844580
380;"Ha az ELTE Eo팯tvo팯s Collegiuma패ba csak felso팲bbe패vesek
jelentkezhetnek, akkor a nyi패lt napon mie패rt kaptunk
szakkolle패giumi felhi패va패st? Mikorto패l lehet csatlakozni?";;2011. ma패j. 26. 21:41;;True;1834776
381;;;2011. ma패j. 26. 21:44;Nem csak felso팲bb e패vesek jelentkezhetnek! Mehetsz elso팲ske패nt is felve패telizni, van is 2 olyan ismero팲so팯m, akik elso팲 e패veske패nt keru팯ltek be.;False;1834776
382;;;2011. ma패j. 26. 22:35;Igen? E패s ma패r az elso팲 fe패le패vben lehet jelentkezni, vagy csak a 2.-to패l?;False;1834776
383;;;2011. ma패j. 26. 23:05;O팲k miuta패n felvette패k o팲ket egyetemre vmikor augusztusban mentek felve패telizni... ba패r lehet va패ltoztattak azo패ta...;False;1834776
384;;;2011. ma패j. 27. 13:10;Ko팯szi! Azt nem tudod esetleg, hogy mik voltak a felve패telin?;False;1834776
385;;;2011. ma패j. 27. 16:48;"Ha패t nem sokat tudok ro패la, annyit viszont elmondhatok, hogy jo패pa패r ember elo팲tt kellett produka패lniuk (asszem 10 egyetemi profot mondtak), ""fejkopogtata패snak"" nevezte패k e패s ele패g rendesen leme패rte패k a tuda패sukat.";False;1834776
386;"Van valakinek valami tapasztalata a Jezsuita Roma
Szakkolle패giummal kapcsolatban?";['Budapest', 'kolle패gium', 'roma', 'lakhata패s', 'szakkolle패gium', 'jezsuita'];2017. dec. 16. 16:53;;True;9026516
387;"ELTE pe패nzu팯gy e패s sza패mviteles hallgato패nak milyen
leheto팲se패gei vannak szakkolle패giumba menni?";['egyetem', 'tanula패s', 'leheto팲se패g', 'ELTE', 'pe패nzu팯gy e패s sza패mvitel', 'szakkolle패gium'];2020. ju패n. 16. 15:31;"Sziasztok!

ELTE패-n tanulok pe패nzu팯gy e패s sza패mvitel alapszakon, most ve패geztem a ma패sodik fe패le패vemmel, e패s azzal kapcsolatosan ke패rdezne패k, hogy van e leheto팲se패gem jelentkezni u팯zleti/ko팯zgazdasa패gtannal foglalkozo패 szakkolle패giumba. Ha igen, akkor hova lehetne jelentkezni? Illetve az nem jelent akada패lyt, hogy ma패r ve패geztem az elso팲 e패vemmel?

Ko팯szo팯no팯m elo팲re is a va패laszokat!
";True;10543121
388;"Jelentkeztem a Ma패rton A패ron Szakkole패giumba, e패s az
eredme패nyek megtekinte패se패ne패l, azt i패rja패k, hogy felvettek,
viszont a lentebb csatolt pdf fa패jlok ko팯zu팯l mie패rt csak a
hata패rozat tekintheto팲 meg?";['kolle패gium', 'Debreceni Egyetem', 'Ma패rton A패ron Szakkolle패gium', 'Bentlaka패si felte패telek', 'Debreceni MA패SZ'];2013. aug. 22. 14:59;"Hol tala패lom meg a bentlaka패si felte패teleket, a tova패bbiak rendeze패se패nek e패rdeke패ben?
";True;4750120
389;;['kolle패gium', 'Debreceni Egyetem', 'Ma패rton A패ron Szakkolle패gium', 'Bentlaka패si felte패telek', 'Debreceni MA패SZ'];2013. aug. 23. 12:19;"A MA패SZ-ba nem kell visszaku팯ldeni a bentlaka패si felte패teleket,itt sok minden ma패s lesz,mint a to팯bbi koliban :)
ha e패rdekel valami irj nekem nyugodtan,ott lakom.";False;4750120
390;"Melyek a legjobb szakkolle패giumok Budapesten egy
ko팯zgazda패sz hallgato패 sza패ma패ra?";['ELTE'];2020. jan. 21. 16:12;"Szeretne패k szakmailag fejlo팲dni, ehhez keresek szakkolle패giumot.

Aja패nla패s melle패 jo패 lenne, ha i패rna패tok ve패leme패nyt is, iletve tana패csot a sikeres felve패telihez.

Nagyon ko팯szi!
";True;10283821
391;;['ELTE'];2020. febr. 3. 14:13;Pe패nzu팯gyi teru팯leten a Heller Farkas a legjobb.;False;10283821
392;Budapesti Ma패rton A패ron Szakkolle패gium?;['egyetem', 'bimasz'];2013. aug. 26. 21:45;"E패rdekelne패nek ve패leme패nyek, hogy milyenek a szoba패k, a tusolo패 e패s maga a ko팯zo팯sse패gi e패let. Elo팲re is ko팯szo팯no팯m :)
";True;4769766
393;"Mi a ve패leme패nyetek a Sa패ntha Ka패lma패n szakkolle패giumro패l,
Debrecenben?";['egyetem', 'Debrecen', 'kolle패gium'];2015. a패pr. 23. 23:08;;True;6795105
394;;['egyetem', 'Debrecen', 'kolle패gium'];2015. a패pr. 25. 11:24;E패s valaki nem tudja milyen eseme패ny volt ott a패prilis 23a패n?;False;6795105
395;Kora패nyi Frigyes szakkolle패gium ve패leme패ny? (Sote);['orvos', 'orvosi', 'Semmelweis', 'kolle패gium', 'SOTE', 'szakkolle패gium', 'Kora패nyi Frigyes'];2019. a패pr. 6. 21:47;"De igazabol aka패rmilyen orvosis szakkolle패giumro패l szi패vesen olvasne패k:)
";True;9828043
396;;['orvos', 'orvosi', 'Semmelweis', 'kolle패gium', 'SOTE', 'szakkolle패gium', 'Kora패nyi Frigyes'];2019. ma패j. 24. 18:40;"Elso팲 ke패t e패vben sok segi패tse패get nyu패jt a ko팯zo팯sse패g e패s ekkor van a legnagyobb szu팯kse패ged erre. Felve패telit a dia패kok tartja패k, objekti패v felme패re패sek alapja패n de sokat sza패mi패t a szubjekti패v bonyoma패s is. (pl vettek ma패r fel la패nyt csak aze패rt mert a sra패cnak tetszett...). Bennmarada패shoz 4-es matematikai a패tlagot kell hozni, ez csak az elso팲 ke패t e패vben lehet nehe패zkes, mert akkor me패g e패rdem szerint osztja패k a jegyeket.

Ha most kezded az egyetemet ve패leme패nyem szerint mege패ri oda jelentkezned.";False;9828043
397;;['orvos', 'orvosi', 'Semmelweis', 'kolle패gium', 'SOTE', 'szakkolle패gium', 'Kora패nyi Frigyes'];2019. ju패n. 15. 23:20;Ko팯szi:);False;9828043
398;"Az ELTE Eo팯tvo팯s Jo패zsef Collegiuma패ba mikor e패s hogyan
lehet jelentkezni? Mikor lesz a felve패teli?";['felve패teli', 'kolle패gium', 'ELTE', 'ELTE TTK', 'szakkolle패gium', 'EJC', 'Eo팯tvo팯s Jo패zsef Collegium'];2012. ju패n. 25. 20:12;"A TTK-ra fogok menni (minden valo패szi패nu팲se패g szerint), de nem tudom, pontosan mikor e패s hogyan kell majd jelentkezni a szakkolle패giumba. Augusztusban sok egye패b elfoglaltsa패gom is lesz (volt gimim go패lyata패bora패ban leszek szervezo팲), e패s jo패 lenne mine패l elo팲bb tudni, hogy vajon ez u팯ti-e a Collegiumi szo패beli felve패telit.
";True;3115588
399;;['felve패teli', 'kolle패gium', 'ELTE', 'ELTE TTK', 'szakkolle패gium', 'EJC', 'Eo팯tvo팯s Jo패zsef Collegium'];2012. ju패n. 25. 21:59;Tavaly az elte패s go패lyata패bort u팯to팯tte a colle패giumos felve패teli...;False;3115588
400;;['felve패teli', 'kolle패gium', 'ELTE', 'ELTE TTK', 'szakkolle패gium', 'EJC', 'Eo팯tvo팯s Jo패zsef Collegium'];2012. ju패l. 6. 16:42;Majd, ha felvettek, az egyetemto팲l ku팯ldo팯tt felve패teli csomagban lesz egy jelentkeze패si lap, azt kell kito팯lteni e패s feladni.;False;3115588
401;;['felve패teli', 'kolle패gium', 'ELTE', 'ELTE TTK', 'szakkolle패gium', 'EJC', 'Eo팯tvo팯s Jo패zsef Collegium'];2013. ju패l. 11. 16:48;bocsi a ke패rde패sre nem tudok va패laszolni, de e패rdekel: milyen szakra jelentkezte패l? :);False;3115588
402;Jo패l tanulo패 egyetemista패k! Ismero팲s a helyzet?;['egyetem', 'tanula패s', 'nyelvvizsga', 'szakkolle패gium', 'konferencia'];2020. ju패l. 6. 17:37;"




Vannak itt olyan egyetemista패k akik kifejezetten jo패l tanulnak e패s nemcsak az alap dolgokat teljesi패tik? Ezen nem azt e패rtem, hogy a tanula패son ki패vu팯l ma패st nem csina패lnak hanem csak annyit, hogy kifejezetten jo패l tanulnak. To팯rekednek a jo패 jegyekre, mennek tdk-ra, esetleg szakkolle패giumba, konferencia패ra, valamilyen versenyre, esetleg to팯bb nyelvvizsga패juk van vagy ba패rmi ami nem az alapko팯vetelme패ny az egyetemen.
Hozza패juk szo패lna a ke패rde패sem: nagyon e패lvezitek ezt az ege패szet vagy inka패bb unja패tok e패s ke패nyszer?
Mi motiva패l titeket?

E패n annyibo패l teljesi패tek to팯bbet az a패tlagna패l (a csoportta패rsaimna패l legala패bbis biztos), hogy to팯bb nyelvvizsga패m van, voltam konferencia패kon ahol bemutattam a saja패t tudoma패nyos eredme패nyeim (ne패melyek mo팯go팯tt nem is volt tana패ri segi패tse패g), voltam OTDK-n e패s szeretne패k jelentkezni egy e패v mu패lva doktori ke패pze패sre.
Alapveto팲en engem ez nagyon e패rdekel, szeretek saja패t eredme패nyt felmutatni, megdolgozni valamie패rt, u패j dolgokat kipro패ba패lni, u패j informa패cio패kra bukkanni, teljesen u패j dolgokat e패s te패ma패kat felfedezni vagy re패gieket u패j szempontbo패l megne패zni. Ennek ellene패re aze패rt ne패ha meg ma패r elegem van e패s egy nyu팲g. Pe패lda패ul mikor pa패lya패zatokat adok be (ide패n 3-at adtam be), akkor alig va패rom, hogy ve패ge legyen vagy pe패lda패ul amikor egy tdk-ro패l van szo패 e패s e패rzem, hogy te패tje van vagy amikor ott is egy raka패s hivatalos dolog kell. Valahogy e패rzek egy bizonyos elva패ra패st is a ko팯rnyezetemto팲l, ba패r ez fe패lig-meddig van csak i패gy mert re패szbe odake패pzelem szerintem. Magam fele패 is vannak elva패ra패saim, vagyis nem elva패ra패sok de van egy szint amit el kell e패rnem, hogy magamban e패rte패keljem magam ele패gge패. Ez nem a ve패gtelense패gig terjed de van egy szint.

Nincs itt valaki akinek ismero팲s ez a helyzet? Ti aze패rt vagytok benne annyi mindenben egyetemen mert nektek ez szi패ntiszta o팯ro팯m vagy van benne egy kis elva패ra패s vagy ele패gedetlense패g is?
";True;10578580
403;;['egyetem', 'tanula패s', 'nyelvvizsga', 'szakkolle패gium', 'konferencia'];2020. ju패l. 6. 18:05;Egy re패sze패t e패lvezem, de a nagy re패sze egy kalap szar, ami helyett inka패bb dolgozni akarok. Mio패ta tudom, hogy mennyire me패ltatlan kutatni e패s hogy az iparban o팯tszo팯ro팯se패t va패gna패k hozza패m annak a be패rnek, amit ko팯zalkalmazottke패nt kapne패k, u패gy vagyok vele, hogy megpro패ba패lok jo패l teljesi패teni, ha ma패r itt vagyok e패s pro패ba패lok megragadni pa패r leheto팲se패get, kipro패ba패lni magak dolgokban, de o팲szinte패n szo패lva nem stresszelem magam tu패l azon, hogy nyertes lesz-e a TDK dolgozatom.;False;10578580
404;;['egyetem', 'tanula패s', 'nyelvvizsga', 'szakkolle패gium', 'konferencia'];2020. ju패l. 6. 18:24;"Ha패t, nem igaza패n. E패n a패ltala패ban olyan 4.3 - 4.5 ko팯zo팯tt szoktam lenni fe패le패v ve패ge패n, e패s semmi energia패m / kedvem me패g TDK dolgozatokat o팯sszea패lli패tani, meg nyalni a to팯bbi kutato패-hallgato패 feneke패t, hogy igaza패n e패rdekes volt az elo팲ada패sod, holott csak azt va패rtam hogy az ege패sznek ve패ge legyen, e패s mine패l hamarabb haza menjek / vissza a kolle패giumba.

1-2 tana패r ma패r felaja패nlotta, hogy felke패szi패tene egy TDK konferencia패ra, de te패nyleg, semmi kedvem hozza패, olyan szinten lehoz az e패letro팲l a folyamatos o패ra패kra valo패 ke패szu팯lo팲de패s.";False;10578580
405;;['egyetem', 'tanula패s', 'nyelvvizsga', 'szakkolle패gium', 'konferencia'];2020. ju패l. 6. 20:11;"E패n alapveto팲en e패lvezem, mert olyan szakon tanulok, ahol ele패g sok anyagot te패nylegesen is hasznosi패tani tudok majd, sok hasznos ta패rgyam van. A haszontalan to팯ltele패kta패rgyakat nyilva패n nem szeretem tanulni. Az egye패b teve패kenyse패geket is szi패vesen csina패lom, egy tanulma패nyi verseny szerveze패se패ben veszek re패szt.
Ami nagyon zavar, hogy sokan lene패znek, stre패bernek titula패lnak, mert ahelyett, hogy dolgozne패k az egyetem mellett, beja패rok az o패ra패kra (nem tudna패m az o패rarendemet e패s a tanula패sra fordi패tott ido팲t semmilyen munka패val o팯sszehangolni), jo패l tanulok, e패s i패gy egyre패szt ege패sz tu팲rheto팲 tanulma패nyi o팯szto팯ndi패jat kapok, ma패sre패szt u패gy keru팯lo팯k majd ki az egyetemro팲l, hogy nem csak diploma패t kapok, hanem e패rteni is fogok ahhoz, amit csina패lok. Sajnos u패gy tu팲nik, hogy ma ez a hozza패a패lla패s lene패zendo팲.";False;10578580
406;;['egyetem', 'tanula패s', 'nyelvvizsga', 'szakkolle패gium', 'konferencia'];2020. ju패l. 6. 20:18;"Me패g anno igen. Az a패tlagom nem volt annyira jo패, ba패r volt fe패le패v, amikor ele패rte a 4,5-o팯t, a패lt. 3,5-4,2 ko팯zo팯tt voltam. Egyre패szt nem ko팯to팯tt le a tanula패s, e패s szi패vesen olvastam szakirodalmat, meg foglalkoztam az anyaggal, de ami kellett volna a jobb jegyhez, a tanko팯nyv meg irodalom to팯ke패letes ismerete, az ma패r nem annyira e패rdekelt.

Az elso팲 ke패t e패vben nem csina패ltam szinte semmit, elkezdtem egy ma패sik szakot pa패rhuzamosan, azt ott is hagytam, mert sok e패rtelme패t nem la패ttam.
Uta패na dia패kszervezetek e패s versenyek ezerrel, szakkoli. A ce패lom az volt, hogy jo패 CV-t tudjak felmutatni, e패s sikeru팯lt megto팯lteni tartalommal nem is keve패ssel. Emellett dolgoztam, mert kellett legala패bb egy e패v gyakornoki tapasztalat. Ele패gge패 tu패lki패na패lat van/volt ebben a szakma패ban, i패gy egy sima egyetemi diploma패val nem sokra mentem volna.

Volt olyan fe패le패v, hogy heti 40 o패ra mellett me패g me패g heti 20 o패ra munka, versenyek, szakkoli, heti 3-4 ZH. Vasa패rnap este패re mentem dolgozni, meg pe패ntek este.

Ke패t dolog nagyon hia패nyzott, ezeket ba패nom. Az egyik, a komolyabb nyelvtanula패s e패s erasmus. Az erasmus kimaradt, igaz finanszi패rozni sem tudtam volna mibo팲l. A ma패sik az OTDK, igaz voltam oppona패lni, meg tervben volt, de egyre패szt nem annyira ko팯to팯tt le, ma패sre패szt protekcio패sok jutottak ki a kari TDK-ro패l csak.";False;10578580
407;;['egyetem', 'tanula패s', 'nyelvvizsga', 'szakkolle패gium', 'konferencia'];2020. ju패l. 8. 13:24;"E패n aze패rt lettem hasonlo패 helyzetben, mint te, mert egyszeru팲en az e패let to팯bbi teru팯lete패n (u패gy 11-12 e패ves koromto패l kezdve) akkora kudarcot vallottam, hogy a karriere패pi패te패s maradt. Mindig sokminden e패rdekelt (nyelvek, to팯rte패nelem, filozo패fia), e패s la패ttam, hogy ha leu팯lo팯k tanulni, abbo패l jobb vagyok, mint az a패tlag. Azaz ke패pes vagyok kiemelkedo팲 eredme패nyeket ele패rni, e패s ez kompenza패lja a maga패ne패letbeli proble패ma패kat.

Nagyon elcseszo팲do팯tt a suliban a ko팯zo팯sse패g, mindenki verte a ma패sikat, a csajoza패saim is rosszul su팯ltek el (volt, aki visszautasi패ta패s uta패n to팯nkre akart tenni), egy re패ma패lom lett minden, e패s egyedu팯l ez maradt, a karriere패pi패te패s.

Most van 2 nyelvvizsga패m (orosz felso팲, angol ko팯ze패p), o팲sszel kezdem a francia패t (ingyen, mert o팯szto팯ndi패jbo패l kapom), OKTV 2. helyezett lettem, e패s elso팲 e패vben kutato패i o팯szto팯ndi패jat vittem, nemre패g pa패lya패ztam meg a ko팯vetkezo팲 e패vit.

Ez egy pszicholo패giai jelense패g. Mikor magamra ne패zek e패s egy lu패zert la패tok, abban a pillanatban bevillan, hogy fizetett kutato패munka패t ve패gzek, to팯bb nyelvet tanulok, orsza패gos versenyen ma패sodik lettem, mellette dia패kmelo패zok e패s me패g karate패zok is heti 3-szor. E패s mikor ezt ne패zem, beugrik, hogy igenis ""e패rte패kes ember vagyok"". Csak nem u패gy, mint az a패tlag, hogy mindenben ko팯zepes, hanem az e패let egyik tere패n egy senki (maga패ne패let, csajoza패s), a ma패sik tere패n viszont tehetse패ges.

De mostanra nagyon meguntam e패n is az ege패szet, mert a maga패ne패letet nem lehet tanula패ssal kipo패tolni.

Ez olyan, mintha valaki e패hes lenne, de nem enne egy falatot se, csak inna helyette. Egy ideig lehet, hogy elu팲zne패k az e패hse패get a cukros italok, de egyszer visszau팯t, e패s baj lesz.

Szo패val e패n eze패rt vagyok ilyen helyzetben.

Nem tudom, la패ny vagy-e vagy fiu패, de ha gondolod, i패rj e패s besze패lhetu팯nk.

20/F";False;10578580
408;"Szakkolle패gium mit jelent pontosan? Oda nem jelentkezhet e패s
nem lakhat aka패rki aki a norma패l kolle패giumokban is?";;2018. febr. 5. 01:48;;True;9124083
409;;;2018. febr. 5. 02:38;"E패n csak arro패l tudok i패rni ahogy na패lunk mu팲ko팯dik, ma패shol nem tudom mennyire te패r el. A패ltala패ban tanulma패nyi a패tlagot vagy a vitt felve패telis pontot ne패zik ide meg hogy mennyire veszel re패szt az egyetemi e패letben (verseny, hallgato패i szervezete meg ilyesmik), van egy minimum hozza패 amit el kell e패rni, mi패g a sima kolina패l ezekre csak egy pontot kapsz de befolya패sol a szocia패lis ha패ttered is. Sima kolina패l mindenre kapsz pontot e패s a rangsor alapja패n keru팯lhetsz be, szakkolina패l meg alapbo패l elutasi패tanak egy adott a패tlag alatt vagy ha nem csina패lsz semmi pluszt. Uta패na o팲k is rangsorolnak, de itt van egy elo팲szu팲ro팲 meg egy felve패teli besze패lgete패s is, ha megfelelo팲 az a패tlagod (erre is adnak egy pontsza패mot). Ba패rki jelentkezhet, egy pro패ba패t mege패r, de nehezebb bekeru팯lni, magasabbak az elva패ra패sok.

Szakko팯ro팯ket elo팲ada패sokat tartanak a szakkoliban, fo팲leg azoknak jo패 akik to팯bbet szeretne패nek tanulni egyetem alatt mint amiket o패ra패n leadnak. Sok versenyfelke패szi패to팲t is tartanak. Ha nem is keru팯lsz be szoktak lenni nyilva패nos elo팲ada패sok amikre ba패rki elmehet vagy ha valamilyen mondjuk esettanulma패nyi verseny e패rdekel ke패szu팯lhetsz szakkolisokkal.";False;9124083
410;"Van olyan (nem valla패si alapon szervezo팲do팲) szakkolle패gium,
ahova pa패zma패nyos joga패szokat is felvesznek?";['jog', 'szakkolle패gium'];2012. ju패l. 24. 20:58;;True;3231280
411;"Egy budapesti ember segi패tse패ge패t ke패rne패m. Hogy lehet a
Keletibo팲l eljutni erre a ci패mre: Balassi Inte패zet Ma패rton
A패ron Szakkolle패gium Igazgato패sa패g,1037 Budapest, Kunigunda
u패tja 35?";;2011. ma패j. 17. 18:09;;True;1807705
412;;;2011. ma패j. 17. 18:30;"Ide bei패rod, e패s to팯bbfe패le u패tvonalat is kidob, te패rke패ppel, utaza패s ido팲tartama패val, ta패volsa패gokkal.
 [link] ";False;1807705
413;;;2011. ma패j. 17. 18:31;Ko팯szo팯no팯m;False;1807705
414;;;2013. ju패l. 30. 15:22;2es metro Batthya패ny te패r, onnan 160 vagy 260-as busz e패s a fehe패regyha패ziu패ton ve패gig , majd balra;False;1807705
415;;;2018. febr. 19. 17:42;Ko팯sz;False;1807705
416;"Egy szakkolle패gium miben ma패s mint egy sima egyetemi
kolle패gium?";['kolle패gium'];2012. ju패l. 30. 16:00;"Milyen ko팯telezettse패gek vannak, illetve milyen elo팲nyei, ha패tra패nyai? Sokkal ko팯to팯ttebb e패s szigoru패bbak a szaba패lyai?
";True;3254168
417;;['kolle패gium'];2012. ju패l. 30. 16:11;A koli amiben lakni tudsz. A szakkoli pedig a koliban egy szervezet. Szo패val igaza패bo패l az egyik alma a ma패sik pedig ma패koste패szta. Legala패bbis a BME-n.;False;3254168
418;"Mindent amit tudtok illetve tapasztaltatok az elit
kolle패giumokro패l I패rjatok le le패tszi? Most
szakkolle패giumokra gondolok stb.";['kolle패gium', 'elit'];2017. jan. 31. 23:01;"Amit tudtok ro패luk stb... ko팯szo팯no팯m a rendes va패laszaitokat!
";True;8405907
