;title;tag;date;text;is_question;id
237;Mie패rt nem vesznek fel szakkolle패giumba?;['szakkolle패gium', 'MCC', 'Mathias Corvinus Collegium', 'Szent Igna패c Jezsuita Szakkolle패gium', 'Bibo패 Istva패n Szakkolle패gium'];febr. 28. 19:59;"Akik szakkolle패gista패k, mese패lne패tek ro패la, hogy milyen eredme패nyekkel keru팯ltetek be?
Mennyi ido팲t vesz el a szabadido팲to팯kbo팲l?
Van olyan aki to팯bb szervezetnek tagja e패s pluszban szakkolis is? Hogy tudja패tok ezt a sok mindent o팯sszeegyeztetni?
Jelenleg egy egyetemi szervezet tagja vagyok, de ezt keve패snek e패rzem, eze패rt gondoltam a szakkolle패giumra. Valamie패rt eddig ahova jelentkeztem nem sikeru팯lt bekeru팯lno팯m, e패s nem nagyon e패rtem az oka패t. Az a패tlagom 4-es fo팯lo팯tt szokott lenni egy kicsivel, viszont publika패cio패m nincs. Ele패g hu팯lye ke패rde패s, de nincs az ismero팲seim ko팯re패ben szakkolis. Ba패rmilyen tana패csot, tapasztalatot ezzel kapcsolatban, szi패vesen venne패k. Mit szeretne패nek a szo패belin visszahallani stb.
";True;10994771
238;;['szakkolle패gium', 'MCC', 'Mathias Corvinus Collegium', 'Szent Igna패c Jezsuita Szakkolle패gium', 'Bibo패 Istva패n Szakkolle패gium'];ma패rc. 1. 20:51;"Mindenfajta cinizmust mello팲zve i패rom, hogy a szakkolle패giumokba amellett, hogy nyilva패n sza패mi패t a szakmai o팯ne패letrajzod (a패tlag, TDK, dia패kszervezetek, tanulma패nyi versenyek stb.), a legfontosabb, hogy nekik mennyire vagy szimpatikus, ebbe belesza패mi패tanak a ne패zeteid e패s bizony arcra is ""oszta패lyoznak"".

MCC-be pe패lda패ul nem fogsz tudni bekeru팯lni baloldali vila패gne패zettel, szintu패gy a ma패sik oldalon TEK szakkolle패giumban nem la패tnak szi패vesen, ha jobboldali gondolkoda패smo패dod van.

A legto팯bb szerintem amit tehetsz egy sikeres felve패telihez, az az, hogy ma패r annak ido팲pontja elo팲tt rendelkezel a kine패zett szakkolle패giumban kapcsolatokkal, akik adott esetben a malmodra hajtja패k a vizet.";False;10994771
239;(BME) Melyik szakkolle패giumba e패rdemesebb jelentkezni?;;2016. febr. 18. 20:34;"Liska Tibor Szakkolle패gium vagy Management Szakkolle패gium?
GTK-s vagyok, mindketto팲 szimpatikus :)
";True;7592601
240;;;2016. febr. 18. 21:43;A Liska a nagyobb, de ne패zd meg mind a ketto팲t, hogy mivel foglalkozik, e패s az alapja패n do팯ntsd el.;False;7592601
241;Miben ma패s a szakkolle패gium?;['egyetem', 'Szeged', 'kolle패gium', 'szakkolle패gium'];2018. aug. 7. 15:46;"Olvastam ro패la ,hogy a kolle패giumok ko팯zo팯tt vannak kifejezetten szakkolegiumok.Ezek miben ku팯lo팯nbo팯znek a ""sima"" kollegiumoktol?
";True;9452792
242;;['egyetem', 'Szeged', 'kolle패gium', 'szakkolle패gium'];2018. aug. 8. 01:24;"




a kolle패giumban ugye csak bennt laksz

a szakkolle패giumban is bennt laksz csak vannak o패ra패k/elo팲ada패sok/programok/besze패lgete패sek amik ko팯telezo팲ek, u패gy lakhatsz bennt hogy teljesi패tesz egy minima패lis elva패ra패st ezekkel kapcsolatban amiket a felve패telikor megadtak
ezek a programok a패ltala패ban ke패szse패gfejleszto팲ek szo패val nagyon nem kell tanulni ra패 de nem merek konkre패tabbat i패rni mert mindenhol ma패smilyen lehet

a szakkolle패giumban meg van hata패rozva hogy az egyetem melyik kara패ro패l mehetnek oda hallgato패k szo패val to팯bbse패gben veled azonos e패rdeklo팲de패si ko팯ru팲 egyetemista패kkal vagy ko팯ru팯lve패ve, sokat tudtok segi패teni egyma패snak(persze ez sima koliban is elo팲fordulhat)
nyilva패n az o패ra패k e패s ko팯vetelme패nyek a szakodhoz kapcsolo패dnak
fontos me패g hogy ezekbe ma패s felve패teli elja패ra패s van, elso팲sorban nem a szocia패lis helyzetet ne패zik hanem behi패vnak elbesze패lgete패sre, kell csina패lnod valami beadando패t esetleg elo팲ada패st, motiva패cio패s leve패l, e패letrajz, a패tlag ... ilyenek
meg a legto팯bb szakkolle패giumba elso팲e패veske패nt me패g nem jelentkezhetsz";False;9452792
243;;['egyetem', 'Szeged', 'kolle패gium', 'szakkolle패gium'];2018. aug. 8. 01:43;"Ko팯szo팯no팯m a re패szletes va패laszt!

Igaza패bo패l elso팲 e패ves hallgato패 vagyok e패s a modulo패ban ma패r tudtam is jelentkezni.

Teha패t akkor az baj,hogy nem i패rtam nekik motiva패cio패s levelet meg stb..?";False;9452792
244;;['egyetem', 'Szeged', 'kolle패gium', 'szakkolle패gium'];2018. aug. 9. 20:46;"nem tudom melyik szakkoliro패l besze패lsz
keress valami ele패rheto팲se패get vagy honlapot e패s ott kideru팯l hogy mi kell a felve패telihez";False;9452792
245;MCC kolle패gium: mege패ri? Be tudok keru팯lni?;['Corvinus', 'szakkolle패gium', 'MCC'];2018. ma패rc. 27. 16:25;"A to팯rte패nelem tana패rom vette fel nekem ezt az o팯tletet, miuta패n OKPV-n 3. helyen ve패geztu팯nk a kis csapatunkkal. A verseny sora패n e패n ke패szi패tettem a prezenta패cio패t, u패gyhogy ezzel nem lenne baj. Valo패szi패nu팲leg 4 e패vig kitu팲no팲 leszek, van angol felso팲foku패 nyelvvizsga패m, az e패rettse패gim valo패szi패nu팲leg 440-460 pont ko팯ru팯l lesz. A corvinusra, pe패nzu팯gy-sza패mvitelre (ha nem jo팯n o팯ssze az a패llami, akkor ugyanitt gazdinfo패ra) szeretne패k menni. A ke패rde패sem az lenne, hogy mennyi i패gy az ese패lyem bekeru팯lni, felte패ve, hogy a prezenta패cio패m (viszonylag) jo패l sikeru팯l? E패s ha bekeru팯lo팯k, mennyire nehe패z a szakkolis e패let? Sokat kell pluszba tanulni? Mennyire van ko팯zo팯sse패gi e패lete az embernek mellette aka패r az egyetemen (HO팯K, vagy egye패b szervezo팲de패sek) vagy azon ki패vu팲l (bara패tok, sport)? Mege패ri megpro패ba패lnom?
";True;9218457
246;;['Corvinus', 'szakkolle패gium', 'MCC'];2018. ma패rc. 27. 18:58;Nem, mert ma ma패r ma패sodszor ke패rdezed ezt.;False;9218457
247;;['Corvinus', 'szakkolle패gium', 'MCC'];2018. ma패rc. 27. 19:22;Az elso팲t ve패letlenu팯l rossz katego패ria패ba i패rtam, eze패rt kito팯ro팯ltem,e패s feltettem a helyes katego패ria패ban a ke패rde패st.;False;9218457
248;;['Corvinus', 'szakkolle패gium', 'MCC'];2018. ma패rc. 27. 19:24;Vagyis nem tudtam kito팯ro팯lni... bocs, nem ismerem annyira a rendszert;False;9218457
249;;['Corvinus', 'szakkolle패gium', 'MCC'];2018. ma패rc. 28. 11:24;Az MCC ele패g jo패 hely, nagyon szi패nvonalas, e패s a ko팯zo팯sse패gi e패leted egy nagy szelete패t is lefedi amu패gy.;False;9218457
250;;['Corvinus', 'szakkolle패gium', 'MCC'];2018. a패pr. 26. 16:42;Milyen gimibo팲l me패sz amu패gy a Corvinusra? :);False;9218457
251;;['Corvinus', 'szakkolle패gium', 'MCC'];2018. a패pr. 27. 06:46;Egy ero팲sebb, vide패ki sulibo패l. Verseghy Ferenc gimna패zium;False;9218457
252;Milyen a budapesti Ma패rton A패ron Szakkolle패gium?;;2016. aug. 1. 17:10;;True;7989495
253;Milyen nehe패z bekeru팯lni egy szakkolle패giumba?;;2011. ju패n. 26. 23:09;"Mert hallja az ember lya패nya/fia, hogy nehe패z bekeru팯lni, de ez relati패v, mennyire nehe패z az a nehe패z?
";True;1932057
254;;;2011. ju패n. 26. 23:22;"Szakkolinke패nt va패ltozik a felve패teli elja패ra패s meg a krite패riumok, meg persze fu팯gg atto패l, beleillesz-e a ta패rsasa패gba, milyen a szeme패lyise패ged, elsza패nt e패s motiva패lt vagy-e.
Melyik szakkoli(k)ro패l van szo패?

Egy szakkolis";False;1932057
255;;;2011. ju패n. 27. 00:14;a mie패nkbe pl. nagyon ko팯nnyu팲 volt.;False;1932057
256;;;2011. ju패n. 27. 13:12;Na패lunk is nagyon ko팯nnyu팲 bekeru팯lni. Jo패 tanulma패nyi a패tlag kell, e패s re패szve패tel a ko팯ze패leti dolgokban. Ha felvesznek akkor felte패telke패nt el kell ve패gezni pa패r melo패t, kutatni kell, vagy ba패rmi. Na패lunk kito팯ltetnek az emberrel egy ke패rdo팲i패vet, hogy a megadott pontokbo패l, mit vagyok hajlando패 teljesi패teni. Ha bei패rom, hogy ott leszek minden ko팯ze패leti rendezve패nyen e패s ja패tszom a lo패tifutit, akkor te패nyleg meg kell csina패lni. Eze패rt pontokat kapnak a bentlako패k. Ha o팯sszejo팯n ele패g pont e패s a tanulma패nyi a패tlag is jo패 marad, akkor maradhat az ember szak koliban.;False;1932057
257;;;2011. ju패n. 27. 13:16;"Az e패n szakkolimban nem sza패mi패t a tanulma패nyi a패tlag (etto팲l fu팯ggetlenu팯l a to팯bbse패gnek nagyon jo패 a패tlaga van, illetve komoly szakmai munka (is) folyik).
Volt egy i패ra패sbeli ke패rdo팲i패v csupa izzaszto패, elgondolkoztato패 ke패rde패ssel, plusz egy szo패beli, ahol hasonlo패an remek ke패rde패sekkel bomba패ztak.
Sza패mi패t a szeme패lyise패g, motiva패ltsa패g, aktivita패s az e패v ko팯zbeni rendezve패nyeken, bevono패 ta패borban, elso팲so팯knek szo패lo패 nyitott kurzusokon valo패 re패szve패tel stb. Hiszen ha teljes jogu패 tag leszel, egyre패szt bele kell illened a ko팯zo팯sse패gbe, ma패sre패szt biztosan tudniuk kell, hogy nem veszed majd fe패lva패llro패l a dolgot.
Maga a felve패teli nem volt nehe패z, maga a folyamat, de a bevono패da패s (nekem legala패bbis) hosszu패 volt, ezalatt jo패l megismerhettek, meg e패n is o팲ket.";False;1932057
258;;;2011. ju패n. 27. 13:17;*de maga a folyamat, a bevono패da패s...;False;1932057
259;;;2011. ju패n. 29. 01:33;06-26 23:22: Kimondottan a Corvinus szakkolle패giumai e패rdekelne패nek.;False;1932057
260;;;2011. ju패n. 29. 06:43;"A Corvinushoz kapcsolo패do패 kolik ko팯zo팯tt is van elte패re패s, van, ahol ne패zik az a패tlagodat, ma패shol nem, van, ahol komolyabb szakmai felve패teli van, ma패shol inka패bb a gondolkoda패smo패dra ki패va패ncsiak, van, ahol nem sza패mi패t annyira, ha e패v ko팯zben nem volta패l ott a legto팯bb rendezve패nyu팯ko팯n, elso팲so팯knek szo패lo패 kurzusaikon, ma패shol ez jelento팲sen cso팯kkenti az ese패lyeidet.

Egye패bke패nt e패n ""corvinusos"" szakkoli tagja vagyok.";False;1932057
261;;;2011. ju패n. 29. 06:43;Pontosan melyik szakkolikro패l besze패lu팯nk?;False;1932057
262;;;2011. ju패n. 29. 12:17;ma 06:43: Te melyikbe vagy e패s milyen a bekeru팯le패s/bekapcsolo패da패s? Mit tudsz a to팯bbiro팲l?;False;1932057
263;;;2011. ju패n. 29. 19:45;"




Hm, na jo패, ela패rulom, e패n SZISZes vagyok (bo팲vebben Sze패chenyi I. Szakkoli).
Van me패g olyan, hogy Rajk, TEK, Heller, EVK, illetve emli패thetne패m me패g az MCC-t, ahol to팯bb egyetemro팲l vannak dia패kok (amu패gy a SZISZben is vannak ELTEsek meg egy BMEs is).
Nagyvonalakban: Heller abszolu패t pe패nzu팯gyes, EVK menedzsment e패s hasonlo패 (gazdasa패gi) profilu패, Rajk gazdasa패gi, mellette aze패rt sok egye패b ta패rs.tud. is ki패na패l, TEK saja패tos szemle패letmo패ddal e패s vila패gne패zettel opera패l (e패rdekesek), SZISZ vegyes, 4 ku팯lo팯nbo팯zo팲 sa패vra lehet jelentkezni. A szakkolle패gista패k do팯ntik el, milyen kurzusokat szeretne패nek hallgatni, e패s azt megszervezik, keresnek hozza패 oktato패t.

A kolik ko팯zo팯tti va패laszta패s atto패l is fu팯gg, milyen szakos/leszel vagy, miben szeretne패l elme패lyu팯lni, szimpatikus-e neked a ko팯zo팯sse패g e패s fordi패tva stb.

Te패nyleg mindegyik szakkolinak ma패s a profilja, a felve패teliztete패si rendje, ma패sban ero팲sek. Oldalakat i패rhatne패k a ku팯lo팯nbse패gekro팲l, ami nem jelenti azt, hogy az egyik jobb lenne, mint a ma패sik - erro팲l szo패 sincs. Inka패bb tapasztald majd meg, ja패rj el elso팲s kurzusokra, ta패borokba stb (ebbo팲l az MCC kive패tel, ott egy nya패ri, ele패g komolyan szakmai felve패teli van, nem bevono패da패s meg ilyesmi). Te패nyleg csak i패gy ismerheted meg a ku팯lo팯nbse패geket, a ta패rsasa패got, eldo팯ntheted, tetszik-e. Nehe패z ezt szavakba o팯nteni.
A패ltala패ban minden koliban szo패beli e패s i패ra패sbeli felve패teli van. Ott van elte패re패s, hogy ne패zik-e a tanulma패nyi a패tlagot, csak elso팲ske패nt vagy elso팲ske패nt e패s ma패sode패veske패nt is lehet jelentkezni, szakmai ke패rde패seket is kapsz-e felve패telin avagy csak a szeme패lyise패gedre, gondolkoda패smo패dodra ki패va패ncsiak-e stb. A felve패teli ke패rdo팲i패vekben e패s a szo패beli alatt is ele패g e패rdekes (""forgatod a szemed e패s az agyad"") ke패rde패seket kell megva패laszolni - javaslom ne패zegesd a kolik honlapja패t a kora패bbi ke패rdo팲i패veket megszemle패lni.

Na de me패g mindig nem a패rultad el, melyik szakkolik ira패nt e패rdeklo팲dsz :)";False;1932057
264;Ja패r/jelentkezett valaki az ELTE A패JK-ra? (re패szletek lent);['kolle패gium', 'ELTE', 'ELTE-A패JK', 'szakkolle패gium', 'ELTE A패JK'];2019. ju패l. 12. 17:57;"Ti jelentkeztek kolle패giumba, esetleg ke패so팲bb szakkolle패giumba? Vide패kike패nt mu팲ko팯dhet a beja패ra패s? Lehet boldogulni kolle패giumban, ha valaki nem tu패l ta패rsasa패gkedvelo팲? Melyik kolle패giumot aja패nlana패tok? Szakkolle패giumro패l ve패leme패ny?
";True;9981950
265;"Ma패sode패veske패nt lehet me패g jelentkezni a Mathias Corvinus
szakkolle패giumba?";['egyetem', 'BME', 'ELTE', 'Corvinus', 'BCE', 'szakkolle패gium', 'MCC', 'BGE'];2017. szept. 13. 17:41;"Ha igen, mikor? Mennyire hasznos?
";True;8858700
266;;['egyetem', 'BME', 'ELTE', 'Corvinus', 'BCE', 'szakkolle패gium', 'MCC', 'BGE'];2017. szept. 15. 00:14;"igen lehet, honlapjukon ne패zd meg :) konkre패tat nem tudok csak ismero팲so팯m ja패r oda

Sok hasznos dolgot tanulnak, de ma패sra nincs ido팲d. Teha패t dolgozni nem tudsz mellette";False;8858700
267;"Van valami tapasztalatotok a Magyar Protesta패ns Tanulma패nyi
Alapi패tva패ny szakkolle패giuma패ro패l?";;2010. aug. 23. 13:52;"Minden e패rdekel. Elo팲re is ko팯szo팯no팯m az informa패cio패kat!!
";True;1113072
268;;;2014. szept. 11. 11:31;"Egy ideje ""Hajdu패 Pe패ter"" az igazgato패, azo패ta ele패g ga패z dolgokat lehet ro패la hallani.
Hajdu패 Pe패tert ke패peletesen e패rtsd , egyfajta gu패nyne패vke패nt: most ra패gugliztam, Csapo패 Tama패snak hi패vja패k a pasit. Aze패rt hi패vja패k Hajdu패 Pe패ternek, mert kb. ugyanolyan figura, egy ilyen a szo패 rossz e패rtelmben vett mindenle패benkana패l ke패pmutato패, o팯ntelt, arroga패ns valaki, e패s ku팯lso팲leg is hasonli패t a feju팯k. A csajokkal a패llando패an flo팯rto팯l , nagyon kive패telezo팲s, pa패r embert mindig kipe패ce패z maga패nak, sunyi, ilyesmiket hallottam ro패la.";False;1113072
269;"Szakkolle패giumokba ma패sodik fe패le패vto팲l is lehet
jelentkezni? Vagy csak e패v eleje패n?";['szakkolle패gium'];okt. 1. 11:49;;True;10724065
270;;['szakkolle패gium'];okt. 1. 23:12;Atto패l fu팯gg, a szakkoli mikor hirdet tagfelve패telt. Na패lunk pl. fe패le패vente, de el tudom ke패pzelni, hogy ez nem mindenhol van i패gy.;False;10724065
271;"Akik a Zsigmond Kira패ly Fo팲iskola패ra (ZSKF) jelentkeztek
(2011 szeptemberi ke패pze패sre) mikorto패l, e패s hogyan lehet a
Ma패rton A패ron Szakkolle패giumba jelentkezniu팯k?";;2011. ma패rc. 12. 11:56;;True;1621492
272;;;2011. ma패rc. 12. 12:14;Ha felvettek, kapsz egy raklap szo패ro패lapot, abban benne lesz, a szakkolis jelentkeze패sek a패ltala패ban e패vko팯zben vannak, szeptember okto패ber ko팯rnye패ke. Valo패szi패nu팲leg go패lyata패borban is fogsz velu팯k tala패lkozni, ott is ke패rdezhetsz, meg gondolom van honlapjuk is.;False;1621492
273;Mennyire nehe패z az ELTE Eo팯tvo팯s Collegiumjaba bejutni?;['ELTE', 'BTK', 'szakkolle패gium'];2015. ju패n. 19. 16:16;;True;6956422
274;;['ELTE', 'BTK', 'szakkolle패gium'];2015. ju패n. 19. 17:34;Vagyis kolle패giuma패ba nem?;False;6956422
275;;['ELTE', 'BTK', 'szakkolle패gium'];2015. ju패n. 20. 04:06;Eo팯tvo팯s Collegium a neve, ebben nincs hiba (ha a 'j'-be ko팯to팯tte패l bele, akkor gratula패lok a szo팲rsza패lhasogata패se패rt) :D;False;6956422
276;;['ELTE', 'BTK', 'szakkolle패gium'];2015. ju패n. 29. 23:28;E패n is ezen agyalok. :o Nem tudom, e패rdemes volna-e jelentkeznem. U패gy fest, egy cipo팲ben ja패runk. ^^;False;6956422
277;"Melyik szakkolle패giumba mehetne패k nyelv szakos
hallgato패ke패nt?";['egyetem', 'nyelv', 'ELTE', 'szakkolle패gium'];2020. ju패l. 24. 03:44;"Az ElTE-re vettek fel, de sajnos nem igaza패n vagyok tiszta패ban,hogy melyik szakkolle패giumban vehetne패nek fel(ha nem ke패stem me패g le a hata패rido팲t),plusz, mik a ko팯vetelme패nyei. Egya패ltala패n van ese패lyem bekeru팯lni? Elo팲re is ko팯szo팯no팯m a va패laszokat!
";True;10608280
278;;['egyetem', 'nyelv', 'ELTE', 'szakkolle패gium'];2020. ju패l. 24. 04:02;*Hozza패tenne패m,hogy ki패nai nyelv szakra sikeru팯lt felve패telit nyernem,viszont eddig nem tala패ltam,olyan szakkolle패giumot ahova felvehetne패nek.;False;10608280
279;;['egyetem', 'nyelv', 'ELTE', 'szakkolle패gium'];2020. ju패l. 24. 10:27;"Szerintem Eo팯tvo팯s.

 [link] ";False;10608280
280;;['egyetem', 'nyelv', 'ELTE', 'szakkolle패gium'];2020. ju패l. 24. 15:25;Ko팯szo팯no팯m sze패pen游땕;False;10608280
281;"ELTE biolo패gia패ra megyek, melyik szakkoliba e패rdemes
jelentkezni?";['egyetem', 'tanula패s', 'biolo패gia', 'iskola', 'kolle패gium', 'ELTE', 'MSc', 'TTK', 'BSC', 'szakkolle패gium'];2018. szept. 7. 18:08;"Bolyai kilo팲ve, mert nem valo패szi패nu팲, hogy tudna패m a 4,5-o팯s a패tlagot teljesi패teni. Van ahol nem ennyire szigoru패ak a felte패telek?
";True;9506292
282;;['egyetem', 'tanula패s', 'biolo패gia', 'iskola', 'kolle패gium', 'ELTE', 'MSc', 'TTK', 'BSC', 'szakkolle패gium'];2018. szept. 7. 18:12;Eo팯tvo팯s?;False;9506292
283;;['egyetem', 'tanula패s', 'biolo패gia', 'iskola', 'kolle패gium', 'ELTE', 'MSc', 'TTK', 'BSC', 'szakkolle패gium'];2018. szept. 7. 19:09;Arra e패n is gondoltam, de ott nem tudom, hogy van-e ilyen hata패r. Kerestem az oldalukon, de sehol aem tala패ltam.;False;9506292
284;"Ma패rton A패ron Szakkolle패giumba hogyan e패s kik
jelentkezhetnek?";;2011. jan. 13. 21:48;"Csak norma패lis va패laszokat le패cci!
Hogy?Kik?E패s mikor/meddig lehet jelentkezni?
Nagyon fontos lenne, le패gyszi ha vki tud segi패tsen.
";True;1461438
285;;;2011. jan. 13. 22:08;Ma패rmint pl a ZSKF-nek nincs kolle패giuma. E패s ha felvesznek az iskola패ba, ott lehetne패k koleszos?;False;1461438
286;"Milyen a Kora패nyi Frigyes Szakkolle패gium? Nehe패z oda
bekeru팯lni?";;2011. ju패l. 13. 14:37;"2 e패v mu패lva a SOTE-ra szeretne패k menni, e패s ebbe a koliba jelentkezni. Sok jo패t olvastam ro패la a neten, meg azt h ide csak a legjobbak keru팯lhetnek. Nagyon szeretne패k ott lenni, ez az a패lmom. Milyen ott az e패let?
";True;1987350
287;;;2011. ju패l. 13. 15:05;Nem vagyok kora패nyis so팲t me패g kolis se, de azt hallottam baromi nehe패z a bejuta패s. Fontold meg. Mindenesetre ha nem is vesznek fel, ha egyetemi polga패r leszel automatikusan mehetsz az elo팲ada패saikra, minden programmjukra, ige패nybe veheted a szolga패ltata패saikat meg minden, csak...;False;1987350
288;Mi a ve패leme패nyetek ezekro팲l a szakkolle패giumokro패l?;['Corvinus', 'BCE', 'szakkolle패gium', 'TEK'];2019. ju패n. 13. 10:45;"Ha minden jo패l megy, akkor ide패n felvesznek a Corvinusra e패s ki패va패ncsi lenne패k, hogy a Rajk illetve a TEK szakkolle패giumokro패l mi a ve패leme패nyetek.

Egya패ltala패n mege패ri szakkolisnak lenni? Milyen embereket szoktak a패ltala패ban felvenni? Nagyon okosnak kell lenni vagy ele패g ha valaki szimpla패n jo패fej?
";True;9932702
289;;['Corvinus', 'BCE', 'szakkolle패gium', 'TEK'];2019. ju패n. 15. 13:56;"Amu패gy aja패nlom neked a HO팯OK mentorprogramot. Ez egy ingyenes program go패lya패k sza패ma패ra teljesen ingyenes. Kapsz magadmelle패 egy felso팲bb e패vest aki segi패t neked az egyetemi u팯gyes bajos dolgokban e패s e패rte패kes tana패csokkal tud ella패tni. Emelett sza패mos ingyenes rendezve패nyre mehetsz el a program kerete패ben. a ponthata패rok ko팯zle패se uta패n lehet jelentkezni majd a HO팯OK mentorprogram oldala패n :)

A ke패rde패sedre ra패te패rve. a felve패telik kora tavasszal vannnak szo패val bo팲ven ra패e패rsz do팯nteni. E패rdemes elmenni a nyi패lt rendezve패nyeikre. Amu패gy egye패rtelmu팲en Rajk, ba패r ele패gge패 belterjes, vizsont a TEK drog*osok gyu팯lekezete";False;9932702
290;;['Corvinus', 'BCE', 'szakkolle패gium', 'TEK'];2019. ju패n. 20. 23:36;"hat a rajkban sem vetik meg a tudatmodosulast lol.

terme패szetesen mege패ri szakkolle패gista패nak lenni, rengeteg pluszt ad tanulmanyilag e패s ko팯zo팯sse패gileg egyara패nt.
a Rajknal nem csak zseniket vesznek fel a szakkolik, a ce패l az egy jo패 e패vfolyam, oszta패lyko팯zo팯sse패g kialaki패ta패sa, ahova패 kellenek zsenik, bulis arcok, introverta패ltak, vide패kiek, pestiek, stb, szo패val aka패r szimpla패n jo패fejnek is ele패g lenned, de ha emelle패 me패g okos is vagy, az nem ha패tra패ny. :)

a tekro팲l nem tudok sokat, csupan annyit h marxistak , ja es egy ev corvinus alatt az e패gvila패gon semmit sem hallottam ro패luk o팲a패ltaluk, teha패t ha nem vagyok proakti패v, akkor nem is tudom hogy le패teznek. szerencse패ju팯kre van egy lista a szakkolikro팲l az egyetemen...";False;9932702
291;Budapesti Ma패rton A패ron Szakkolle패gium milyen hely?;;2009. ju패l. 18. 20:58;"Lakott ma패r vki ott, e패s milyen hely? Ko팯zo팯sse패g jo패?
";True;327099
292;;;2009. ju패l. 25. 17:12;Jo패 hely, nekem to팯bb ismero팲so팯m is lakik ott, egyszer a bulijukra is elmentem.;False;327099
293;"SZTE-n fogok tanulni. Melyik koleszt aja패nlana패tok? Mo패ra
Ferenc Szakkolle패gium vagy Teleki Blanka Kolle패gium?";['Szeged', 'kolle패gium', 'SZTE'];2017. aug. 9. 13:43;"Elo팲re is ko팯szo팯net a segi패tse패ge패rt!
";True;8790479
294;;['Szeged', 'kolle패gium', 'SZTE'];2017. aug. 9. 16:55;"Milyen szakra fogsz ja패rni?
A Teleki a jugyusoke패, a Mo패ra pedig karko팯zi kolle패gium. Nem tudsz mindketto팲be jelentkezni egyszerre.";False;8790479
295;"Van valaki, aki a szegedi Ma패rton A패ron Szakkolle패giumban
lakik? Ve패leme패nyek e패rdekelne패nek.";['Szeged', 'Ma패rton A패ron Szakkolle패gium'];2015. ju패l. 28. 21:39;;True;7070610
296;Szakkolit i패rna패tok bele CV-be a tanulma패nyokhoz?;['egyetem', 'munka', 'jelentkeze패s', 'o팯ne패letrajz', 'CV', 'szakkolle패gium'];2019. a패pr. 7. 23:02;;True;9829838
297;;['egyetem', 'munka', 'jelentkeze패s', 'o팯ne패letrajz', 'CV', 'szakkolle패gium'];2019. a패pr. 8. 08:21;"Persze.

Ma ma패r nem nagyon i패runk CV-t. LinkedIn profilt i패runk, e패s azt szabjuk testre a konkre패t a패lla패sra. A LinkedIn profilban meg sima패n elfe패r.";False;9829838
298;Van e패rtelme a szakkolle패giumhoz csatlakozni? Mege패ri?;;2016. szept. 12. 18:41;;True;8095772
299;Milyen a szegedi jezsuita koli?;['egyetem', 'Szeged', 'kolle패gium', 'SZTE', 'szakkolle패gium', 'jezsuita', 'Kaszap Istva패n'];2019. aug. 17. 08:33;;True;10042648
300;"Van Magyarorsza패gon olyan
program/ke패pze패s/konferenciasorozat/gyakornoki
program/inte패me패ny/ba패rmi, amely kifejezetten a
fenntarthato패sa패g ke패rde패sko팯re패vel foglalkozik?";['ko팯rnyezetve패delem', 'egyetem', 'mester', 'ke패pze패s', 'me패rno팯k', 'gyakornok', 'gazdasa패gtan', 'inte패zme패ny', 'fenntarthato패sa패g', 'szakkolle패gium'];2016. okt. 21. 16:45;"Me패rno팯khallgato패 vagyok, e패rdekel a fenntarthato패sa패g annak ba패rmilyen e패rtelmeze패se패ben, elo팲sorban a tudoma패nyos teru팯let e패s a ko팯rnyezethez kapcsolt ke패rde패sko팯reivel e패s szeretne패m effele패 ira패nyi패tani valahogy a szakmai profilomat. Ebben tudtok segi패teni? Ez egy ele패g o팯sszetett ke패rde패s, tudom. Februa패rban ve패gzek villamosme패rno팯kke패nt BSc ke패pze패sen e패s szeretne패k tova패bb haladni u패gy, hogy megtala패ljam a sza패momra igaza패n e패rdekes teru팯letet. Ehhez keresek inte패zme패nyeket, szakkolle패giumokat, ahova lehet csatlakozni esetleg. Gyakornoki pozi패io패ba is menne패k szi패vesen, de februa패rto패l megszu팲nik a jogviszonyom is, a패llamvizsga패t ko팯veto팲en. TOva패bb ke패rde패sem, hogy milyen mesterke패pze패st aja패nlotok, ha kli패mava패ltoza패s, ko팯rnyezetve패delem, energetika e패rdekel annak mu팲szaki, gazdasa패gi, jogi e패rtelmeze패se패ben is aka패r? Ko팯szo팯no팯m elo팲re is!
";True;8176960
301;;['ko팯rnyezetve패delem', 'egyetem', 'mester', 'ke패pze패s', 'me패rno팯k', 'gyakornok', 'gazdasa패gtan', 'inte패zme패ny', 'fenntarthato패sa패g', 'szakkolle패gium'];2016. okt. 21. 21:23;e패s 7(?) fe패le패v villanykar alatt erro팲l nem mondtak semmit? ko팯tve hiszem...;False;8176960
302;;['ko팯rnyezetve패delem', 'egyetem', 'mester', 'ke패pze패s', 'me패rno팯k', 'gyakornok', 'gazdasa패gtan', 'inte패zme패ny', 'fenntarthato패sa패g', 'szakkolle패gium'];2016. okt. 22. 00:34;"Ennek a kommentnek semmmi e패rtelme nem volt. A ke패rde패st aze패rt tettem fel, ha패tha kapok hasznos o팯tleteket, tippeket, esetleg i패r valaki, aki hasonlo패 cipo팲ben ja패r. O팲szinte패n szo패lva a magyar felso팲oktata패sban a fenntarthato패sa패g nem annyira e패lenja패ro패 fogalom, me패gha sokszor is tala패lkozni vele, o팯ssze sem hasonli패thato패 ahhoz ke패pest, amit egy e패szaki vagy nyugat-euro패pai orsza패gban lehet tapasztalni.

Ennek megfelelo팲en egy sztenderd villamosme패rno팯k sem a fenntarthato패sa패gro패l tanul itthon (hazudik aki azt mondja). A villamosme패rno팯ki tudoma패ny e패rinti azt. Ennek megfelelo팲en e패n is e패rinto팲legesen kaptam betekinte패st. Ezt szeretne패m bo팲vi패teni, mert eddig nem foglalkoztam ku팯lo팯no팯sebben ezzel a ke패rde패sko팯rrel magyar kontextusban, i패gy most ki패va패ncsi lettem, haza패nkban vajon pontosan kik/mik azok, akik/amik ezzel foglalkoznak.";False;8176960
