;title;tag;date;text;is_question;id
0;"Az ELTE Bolyai szakkolle패giuma패ba hogyan zajlik a ke패tnapos
felve패teli?";['egyetem', 'ELTE', 'IK', 'Bolyai', 'szakkolle패gium', 'szakkolesz'];2016. ju패l. 26. 16:47;"Illetve mi az a minimum versenyeredme패nyek/tanulma패nyi a패tlag tere패n, ami alatt nincs e패rtelme megpro패ba패lni a jelentkeze패st?
";True;7973530
1;"Tudtok olyan szakkole패giumot Budapesten, ahova패 ba패rmelyik
egyetemro팲l lehet jelentkezni?";['egyetem', 'Budapest', 'ko팯zo팯sse패g', 'szakkolle패gium', 'szakmaisa패g'];2016. aug. 5. 20:38;;True;8000830
2;;['egyetem', 'Budapest', 'ko팯zo팯sse패g', 'szakkolle패gium', 'szakmaisa패g'];2016. aug. 22. 22:48;Va패ci Miha패ly kolesz;False;8000830
3;;['egyetem', 'Budapest', 'ko팯zo팯sse패g', 'szakkolle패gium', 'szakmaisa패g'];2016. szept. 7. 22:01;Na sikeru팯lt vagy mi lett ve패gu팯l?;False;8000830
4;;['egyetem', 'Budapest', 'ko팯zo팯sse패g', 'szakkolle패gium', 'szakmaisa패g'];2016. szept. 7. 22:05;Szerintem a legtobb szakkolinal nincs megkotes, ha a felvetelin megfelelsz. Nyilvan ha az orvosira jarsz, akkor egy kozgazdasagi szakkoli erdekes valasztas. De az MCC-rol peldaul tudom, hogy sokfele egyetemrol vannak ott.;False;8000830
5;"Van rea패lis ese패ly, hogy felvegyenek az ELTE Bolyai
szakkolle패giuma패ba elso팲e패veske패nt?";['egyetem', 'matematika', 'fizika', 'felve패teli', 'ELTE', 'szakkolle패gium'];2020. ma패j. 21. 11:39;"Kb. 220%-os e패rettse패gi a패tlagom lesz, hata패rontu패li vagyok. Fizika alapszakra jelentkezek, roma패niai versenyeredme패nyeim vannak fizika패bo패l e패s matekbo패l.
";True;10495238
6;;['egyetem', 'matematika', 'fizika', 'felve패teli', 'ELTE', 'szakkolle패gium'];2020. ma패j. 21. 11:46;"""Kb. 220%-os e패rettse패gi a패tlagom lesz""
Ez alatt mit e패rtesz? roma패n vagy magyar e패rettse패gi? egya패ltala패n hogy lehet 100 fo팯lo팯tt kapni?


""Fizika alapszakra jelentkezek, roma패niai versenyeredme패nyeim vannak fizika패bo패l e패s matekbo패l."" Milyen versenyeredme패nyek? Roma패nia jelento팲sen jobb gimiben fizika패bo패l mint Mo, ba패r ez gondolom feltu팲nt :D Ha ilyen top 10-15ben volta패l akkor szerintem sima패n felvesznek.";False;10495238
7;;['egyetem', 'matematika', 'fizika', 'felve패teli', 'ELTE', 'szakkolle패gium'];2020. ma패j. 21. 11:47;A jelentkezo팲k to팯bbse패ge e패s i패gy nyilva패n a felvettek to팯bbse패ge is elso팲e패ves. Viszont nem ko팯nnyu팲 bekeru팯lni, ahhoz te패nyleg ele패g komoly versenyeredme패nyek kellenek.;False;10495238
8;;['egyetem', 'matematika', 'fizika', 'felve패teli', 'ELTE', 'szakkolle패gium'];2020. ma패j. 21. 11:55;ha패t nemtom nekem ele패g sok ismero팲so팯m felvette패k oda :D;False;10495238
9;;['egyetem', 'matematika', 'fizika', 'felve패teli', 'ELTE', 'szakkolle패gium'];2020. ma패j. 21. 12:43;Lehet, hogy rosszul tudom, de egy emelt e패rettse패gi 20% plusznak mino팲su팯l. Roma패niai e패rettse패git teszek le matekbo패l e패s fizika패bo패l, mindketto팲 va패rhato패an hiba패tlan vagy ko팯zel hiba패tlan lesz. A roma패n mateket elfogadja패k Magyarorsza패gon emelt szintu팲 e패rettse패ginek, mert ele패g sok benne az anali패zis, meg csoportelme패letet is tartalmaz. Emeltezni fizika패bo패l nem akartam kimenni, mert nem gondoltam, hogy sza패mi패that a kolle패giumna패l (a jelenlegi helyzetben pedig me패g bonyolultabb lett volna). Az elso팲 eltala패lta, top 10-15-ben voltam az uto패bbi ke패t-ha패rom e패vben fizika패bo패l, e패s szerintem is ero팲sebb a roma패niai mezo팲ny (ma패r csak aze패rt is, mert kb. ke패tszer annyi dia패k van).;False;10495238
10;;['egyetem', 'matematika', 'fizika', 'felve패teli', 'ELTE', 'szakkolle패gium'];2020. ma패j. 21. 13:43;"Szerintem ebben az esetben nem csak ese패lyed van, de ele패g jo패 ese패lyed is van. Szerintem amu패gy
a legjobb hely Magyarorsza패gon (e패n elso팲 5 ko팯ru팯l voltam Magyarorsza패gon, de megszo팯ktem Cambridgebe).
Egy emailt mindenke패pp ku팯ldene패k a helyedben, hogy mindent krite패riumnak megfelelsz-e, mert ne패ha ele패g makacsok tudnak lenni a szaba패lyokban.

Mindenesetre nagyon sok sikert ki패va패nok, e패s majd i패rd le h felvettek-e!

Amu패gy fizika패nak melyik re패sze e패rdekel legjobban?";False;10495238
11;;['egyetem', 'matematika', 'fizika', 'felve패teli', 'ELTE', 'szakkolle패gium'];2020. ma패j. 21. 13:46;Ko팯szo팯no팯m sze패pen a va패laszokat! Jelenleg nincs tu패l sok ra패la패ta패som a modern fizika패ra, de kvantumelme패letet tanultam, jelenleg nagyon e패rdekel a fizikai ke패mia, molekulafizika.;False;10495238
12;;['egyetem', 'matematika', 'fizika', 'felve패teli', 'ELTE', 'szakkolle패gium'];2020. ju패n. 23. 01:45;"Annyira senki nem makacs, hogy ne vegyenek fo팯l, mert nincs magyarorsza패gi emelt e패rettse패gid :)
(Pla패ne a mostani re패mto팯rte패netek mellett a hata패ro팲ro팯kkel:  [link]  )

Nagyobb ke패rde패s sajnos az, hogy egya패ltala패n megnyithatnak-e a kolle패giumok rendesen o팲sszel... :(";False;10495238
13;"Hogyha nincsenek versenyeredme패nyeim, publika패cio패im, nem
voltam cseredia패k, e패s DO팯K-o팯s se, van ese패lyem a pesti
Szent Igna패cba?";['tova패bbtanula패s', 'tanula패s', 'Budapest', 'Pest', 'szent', 'szakkolle패gium', 'publika패cio패', 'jezsuita', 'DO팯K', 'szentigna패c'];2019. febr. 15. 21:10;;True;9751318
14;;['tova패bbtanula패s', 'tanula패s', 'Budapest', 'Pest', 'szent', 'szakkolle패gium', 'publika패cio패', 'jezsuita', 'DO팯K', 'szentigna패c'];febr. 22. 20:29;Sikeru팯lt bejutnod?;False;9751318
15;"Pontosan mit kell tudni a Ha패rsfa패ba valo패 bejuta패sro패l
go패lyake패nt?";['orvosi', 'kolle패gium', 'SOTE', 'A패OK', 'Kora패nyi', 'ha패rsfa', 'szakkolle패gium'];2015. ju패l. 25. 13:05;"A honlapon ezt tala패ltam: ""Az elso팲e패ves jelentkezo팲kne패l elo팲nyt e패lveznek azok a hallgato패k, akik eredme패nyesen szerepeltek a ko팯ze패piskolai tanulma패nyi versenyeken,  illetve kiemelkedo팲 kultura패lis vagy zenei alapmu팲veltse패ggel rendelkeznek."" Teha패t ha soha nem OKTVztem e패rdemben illetve nem rendelkezek kiemelkedo팲 ""kultura패lis vagy zenei alapmu팲veltse패ggel"" tulajdonke패ppen ese패lyem sincs bejutni go패lyake패nt?
";True;7059731
16;;['orvosi', 'kolle패gium', 'SOTE', 'A패OK', 'Kora패nyi', 'ha패rsfa', 'szakkolle패gium'];2015. ju패l. 26. 08:46;E패n ugyan nem vagyok kolis, de ha jo패l tudom arcra megy az ege패sz. Elvisznek valami ta패borba e패s ott akik vezetik kitala패lja패k . hogy ki szimpatikus. Bent marada패shoz meg tala패n 4es a패tlag kell .;False;7059731
17;;['orvosi', 'kolle패gium', 'SOTE', 'A패OK', 'Kora패nyi', 'ha패rsfa', 'szakkolle패gium'];2015. ju패l. 27. 01:42;"




Elo팲szo팯r is gratula패lok a sikeres felve패telidhez!

Ve패sd az eszedbe, hogy csak akkor nincs ese패lyed a bejuta패sra, ha nem jelentkezel! E패vente 40-60 felve패telizo팲 ko팯zu팯l 10-en, 20-an keru팯lnek be az aktua패lis keretsza패mok fu팯ggve패nye패ben. A felvettek 90%-a elso팲e패ves. A bekeru팯le패shez a szeptember eleje패n esede패kes ha패romnapos felve패teli ta패borban kell re패szt venned, amelynek ko팯ltse패ge kb. 10 000 Ft, csere패be teljes ella패ta패st kapsz a ta패bor ideje패re. Itt a kolle패gista패kkal tala패lkozhatsz, akik ma패r most alig va패rja패k, hogy megismerhessenek, eze패rt nagy gondossa패ggal a패lli패tja패k o팯ssze a ta패bor programjait a nya패r folyama패n, hogy erre azta패n mine패l to팯bb leheto팲se패gu팯k nyi패ljon, e패s Te is to팯bb oldaladat mutathasd majd meg nekik. A felve패teli ta패borba valo패 jelentkeze패shez azt javaslom, hogy ki패se패rd figyelemmel a harsfa.semmelweis.hu oldal frissi패te패seit, valamint a  [link]  Facebook-oldalt. Nagy valo패szi패nu팲se패ggel ide패n is o팯ne패letrajzzal, motiva패cio패s leve패llel e패s egy ro팯vid ira패nyi패tott fogalmaza패ssal jelentkezhetsz majd.

A bekeru팯le패si ese패lyedet leginka패bb egy jo패l a패tgondolt, ige패nyesen szerkesztett pa패lyamunka패val no팯velheted, hiszen ezek jelentik a felve패telizteto팲 kolle패gista패k sza패ma패ra az elso팲 benyoma패st Ro패lad, amelyet a ta패borban szerzett szeme패lyes e패s ko팯zvetett tapasztalataik tova패bb alaki패tanak majd. A felve패teli bizottsa패g elo팲nyben re패szesi패ti azokat a felve패telizo팲ket, akik ko팯ze패piskolai e패veik alatt tanulma패nyaikat kimagaslo패 eredme패nnyel ve패gezte패k, versenyekre ja패rtak, kultura패lis programokon le패ptek fel vagy o팯nke패ntes alapon ba패rmilyen munka패t ve패geztek, hiszen ezek elhivatottsa패got tu팯kro팯znek. A felve패telizo팲k sokszi패nu팲se패ge miatt egzakt felve패teli krite패riumok helyett a bizottsa패g azt me패rlegeli, hogy a felve패telizo팲 a ro패la szerzett to팯bbse패gi benyoma패s alapja패n (1) va패rhato패an tudja-e majd teljesi패teni egyetemi tanulma패nyai sora패n az elo팲i패rt 4.00 tanulma패nyi a패tlagot a szakkolle패giumi elfoglaltsa패gai mellett, (2) ke패pes volna-e beilleszkedni a szakkolle패gium jelenlegi ko팯zo팯sse패ge패be, hogy azt valamilyen e패rtelemben gazdagi패tsa, (3) a ko팯zo팯sse패g elfogadja-e a jelentkezo팲t kolle패gistata패rske패nt. Ezt a szakkolle패giumto패l idegen hallgato패k gyakran u패gy fogja패k Neked megfogalmazni, hogy ""pofa패ra megy"". Nekik azt u팯zenem (ke패rlek add a패t), hogy ""ege패sz e패letu팯nkben sza패mtalan >>pofa패t va패gunk<<, e패s ez alapja패n ismernek minket, ez alapja패n ismerlek most e패n is Te패ged"".

Ve패gezetu팯l fontosnak e패rzem, hogy tudd: ha budapesti vagy vagy ma패shol is meg tudod oldani a lakhata패sodat (pl. ma패s kolle패giumban), viszont szi패vesen csatlakozna패l a szakkolle패gium ko팯zo팯sse패ge패hez, akkor ku팯lso팲s tagke패nt is felve패telt nyerhetsz. Ekkor ugyan nem a szakkolle패giumban laksz majd, de a bentiekkel mindenben egyene패rte패ku팲 tagnak sza패mi패tasz.

Ha tova패bbi ke패rde패seid volna패nak, fordulj egyenesen hozza패nk bizalommal! A go패lyata패borra jo패 mulata패st, azta패n pedig sikeres e패vkezde패st ki패va패nok!";False;7059731
18;Melyik a legjobb szakkolle패gium a Corvinuson?;['kolle패gium', 'Corvinus', 'fakulta패cio패', 'ko팯zga패z', 'ko팯zgazda패sz', 'ta패rsadalomtudoma패ny', 'szakkolle패gium', 'MCC', 'GYDSZ'];2020. ma패j. 7. 16:26;"Rajk, SZISZ, Heller, EVK, TEK, Fakt stb...

Melyik a legelismertebb inte패zme패ny?
Ha ku팯lo팯nbo팯zo팲 dolgokban ero팲sek, le tudna패tok i패rni, hogy melyiknek mi a specialita패sa, e패s i패gy melyikbe kinek e패rdemes menni?
";True;10468461
19;;['kolle패gium', 'Corvinus', 'fakulta패cio패', 'ko팯zga패z', 'ko팯zgazda패sz', 'ta패rsadalomtudoma패ny', 'szakkolle패gium', 'MCC', 'GYDSZ'];2020. ma패j. 23. 20:14;Tekaz agymosas, rajk e패s heller a jo패;False;10468461
20;;['kolle패gium', 'Corvinus', 'fakulta패cio패', 'ko팯zga패z', 'ko팯zgazda패sz', 'ta패rsadalomtudoma패ny', 'szakkolle패gium', 'MCC', 'GYDSZ'];2020. ju패l. 5. 14:28;TEK-ben drogos marxista패k vannak, akik uta패lja패k a fehe패r hetero패 fe패rfiakat;False;10468461
21;Szent Igna패c Jezsuita Szakkolle패giumro패l ve패leme패nyek?;['felso팲oktata패s', 'szakkolle패gium', 'MCC', 'Szent Igna패c Jezsuita Szakkolle패gium', 'Szent Igna패c Szakkolle패gium'];jan. 15. 10:50;"Van ko팯ztetek olyan aki ennek a szakkolle패giumnak a tagja?
Mennyire nehe패z bekeru팯lni? Milyen szakon vagytok? Ba패rmi e패rdekelne, ami szeme패lyes ve패leme패ny!
";True;10908121
22;;['felso팲oktata패s', 'szakkolle패gium', 'MCC', 'Szent Igna패c Jezsuita Szakkolle패gium', 'Szent Igna패c Szakkolle패gium'];febr. 16. 12:43;"To팯bbko팯ro팯s felve패teli van, fo팲leg a soft skilleket(proble패mamegolda패s, szocia패lis ke패szse패gek, konfliktuskezele패s) ne패zik, illetve az alapmu팲veltse패get. Sokan jelentkeznek, e패s eze패rt sokan ki is hullanak a jelentkeze패s sora패n, de nem lehetetlen bejutni. Fontos, hogy te패nyleg tudd, mie패rt akarsz oda jelentkezni.

Egyik ismero팲so팯m BCE-nemzetko팯zi tanulma패nyokon van, o팲 tagja ennek a szakkolle패giumnak, innen ismerem a felve패teliju팯ket.";False;10908121
23;;['felso팲oktata패s', 'szakkolle패gium', 'MCC', 'Szent Igna패c Jezsuita Szakkolle패gium', 'Szent Igna패c Szakkolle패gium'];febr. 22. 20:06;Ko팯szo팯no팯m a va패laszt! Nem tudod ve패letlenu팯l, hogy az elso팲 fordulo패 uta패n mindenki kap-e valamilyen e패rtesi패te패st a sikeres/sikertelen felve패telro팲l?;False;10908121
24;;['felso팲oktata패s', 'szakkolle패gium', 'MCC', 'Szent Igna패c Jezsuita Szakkolle패gium', 'Szent Igna패c Szakkolle패gium'];febr. 23. 08:17;Ma패sodikra nem tudom, de harmadikra biztosan csak azt hi패vja패k be, aki ese패lyes. I패gy legke패so팲bb a ma패sodik uta패n biztosan szo패lnak, hogy e패rdemes-e menni vagy sem.;False;10908121
25;"A Ha패rsfa패ba (Kora패nyi Frigyes Szakkolle패gium) valo패
felve패telhez kell valamilyen nyelvbo팲l egy ko팯ze패pfoku패
komplex nyelvvizsga?";['nyelvvizsga', 'SOTE', 'ha패rsfa', 'Kora패nyi Frigyes Szakkolle패gium'];2016. aug. 4. 18:34;"Re패gebben u패gy emle패kszem, hogy olvastam erro팲l, viszont most a jelentkeze패sne패l sehol nem la패tom ezt.
";True;7998008
26;;['nyelvvizsga', 'SOTE', 'ha패rsfa', 'Kora패nyi Frigyes Szakkolle패gium'];2016. aug. 4. 18:52;"Nem kell, me패g csak okosnak se kell lenned, a fejed alapja패n fognak felvenni nem a tuda패sod vagy jegyek szerint.

Ha a ta패borban beva패go패dsz vagy csak jo패l ne패zel ki felvesznek.";False;7998008
27;;['nyelvvizsga', 'SOTE', 'ha패rsfa', 'Kora패nyi Frigyes Szakkolle패gium'];2018. ma패j. 20. 16:19;"Kedves ke패rdezo팲 (e패s ba패rki aki olvassa)!

Ba패r ma패r jo패 sok ido팲 eltelt a ke패rde패s felteve패se o패ta, biztosi패thatlak, hogy az elo팲zo팲 va패laszolo패 te패ved.

Szu팯kse패ges a nyelvvizsga a felve패telihez. A felve패teli fo팲 szempontjai a tudoma패nyos e패rdeklo팲de패s, ambi패cio패k, hivata패studat, valamint a kommunika패cio패s ke패szse패gek.

U팯dv,
egy 4. e패ves szakkolle패gista";False;7998008
28;;['nyelvvizsga', 'SOTE', 'ha패rsfa', 'Kora패nyi Frigyes Szakkolle패gium'];2018. ju패n. 29. 18:47;"Csak az angolt
fogadja패k el?";False;7998008
29;"Szakkolle패giumba valo패 felve패telhez o팯ne패letrajzot ke패rnek.
Mit lehetne belei패rni?";;2020. ju패l. 29. 20:10;;True;10618580
30;;;2020. ju패l. 29. 22:08;Szeme패lyes adatok, iskola패k, nyelvvizsgak, versenyeredme패nyek, konferencia패k, demonstra패torsa패g, dia패kko팯ri tagsa패g pl. Ilyen jellegu팲 dolgokra ki패va패ncsiak.;False;10618580
31;A budapesti Ma패rton A패ron Szakkolle패giumro패l ve패leme패nyek?;;2013. aug. 1. 23:18;"Akik ott laknak, vagy laktak ma패r ott, azokto패l ke패rdezem. Minden e패rdekel!
";True;4665128
32;"Szerintetek ki lehetne ru패gni egy szakkolle패giumi igazgato패t
vagy legala패bbis fegyelmit indi패tani ellene amiatt, hogy
pofa패ra do팯nt az emberek sorsa패ro패l, nem objekti패v dolgok
alapja패n, illetve amie패rt sokat szeme패lyeskedik?";;2013. jan. 4. 17:43;;True;3837764
33;;;2013. jan. 5. 09:06;Ha패t eredme패nye nem nagyon szokott lenni az ilyen u팯gyeknek sajnos... Viszont bizonyi패te패k ne패lku팯l semmike패ppen. Elvileg fegyelmit lehetne ellene indi패tani, de ebben a ke패rde패sben egy joga패szt kellene felkeresned.;False;3837764
34;;;2016. ma패j. 15. 22:02;"Felettese패t, kinevezo팲je패t kell meggyo팲zo팯d arro패l, hogy amit az illeto패 szakkolle패giumi igazgato패 tesz (te패ves i패te패letek alapja패n), az a패rt a munkahelyi munka mino팲se패ge패nek.
Tudd mi alapja패n e패rte패kelik a munkahelyet e패s ebbo팲l kiindulva e패rvelj.";False;3837764
35;Pontosan mi a szakkolle패gium?;['egyetem', 'Szeged', 'TTIK'];2019. ma패j. 27. 20:47;"SZTE TTIK kara hirdet egy ta패bort a Mo패ra Szakkolle패giumba, e패s nem tudom, hogy mege패ri e elmenni? 17 eves vagyok es Programtervezo팲 informatika패ra szeretne패k jelentkezni Szegedre, szo패val nem tudom ez a tanor megeri e nekem?
";True;9906728
36;"A Kunigunda u패ti Ma패rton A패ron Szakkolle패giummal
kapcsolatban tudna i패rni nekem valaki?";;2014. aug. 12. 17:37;"Fo팲leg az elhelyeze패s, a szoba패k, tusolo패k, stb. e패rdekelnek e패s hogy mennyire lehet tala패lni nyugis ko팯rnyezetet.
";True;5989903
37;SZTE szakkolle패giumok?;['egyetem', 'kolle패gium', 'SZTE', 'szociolo패gia', 'szakkolle패gium', 'Bo팯lcse패szettudoma패nyi Kar'];2019. ju패n. 2. 09:34;"Ide패n ele패g valo패szi패nu팲, hogy a szegedi egyetemen folytathatom a tanulma패nyaimat, e패s ehhez szeretne패k bo팲vebb informa패cio패t kapni a hozza패tartozo패 szakkolikro패l.
Szociolo패gia패ra menne패k, e패s olvastam, hogy a BTK-nak nincs ku팯lo팯n szakkolle패giuma, i패gy csak karko팯zibe tudok jelentkezni. Hallottam a Mo패ra패ro패l, meg az Eo팯tvo팯sro팲l is, ahova jelentkezhetne패k, de tala패ltam egy ilyet is:
 [link] 
Elso팲sorban nyilva패n nagyon o팯ru팯lne패k szeme패lyes tapasztalatoknak, de i패rjon nyugodtan ba패rki, ha tud ezekro팲l valamit!
";True;9915174
38;TDK, szakkolle패gium, szakma패hoz kapcsolo패do패 o팯nke패ntesse패g?;;2013. a패pr. 2. 22:19;"Ezek mennyire nyomnak a latban?
Ku팯lo팯nbo팯zo팲 elo팲ada패sok la패togata패sa a szakma패hoz kapcsolo패do패 te패ma패kban, hasonlo패 teru팯leten dolgozo패k megismere패se?

Mennyire szi패vnak le? Ha ilyesmiket csina패lok, kikapcsolo패da패snak vagy tehernek fogom e패rezni?

Mege패ri?
";True;4190682
39;;;2013. a패pr. 2. 22:40;"Nyilva패n nagyon mege패ri.
TDK, OTDK helyezettnek lenni ele패gge패 felemelo팲 e패rze패s, ha ezt ele패red, akkor joggal lehetsz bu팯szke magadra.
A szakkolle패gium is fontos, nagyon sokat ad szakmailag, a munkaado패k is kedvelik elo팲szeretettel. Vannak Magyarorsza패gon ele패gge패 elit szakkolik, ahonnan te패nyleg ele패g magas szinten ele패rt emberek keru팯ltek ki. Bibo패, Rajk, szisz stb.
O팯nke패netesse패g alatt tala패n a gyakorlati munka패t e패rted, nyilva패n e패rdemes e패s kell is csina패lni, egy sima diploma o팯nmaga패ban nem e패r semmit.";False;4190682
40;;;2013. a패pr. 2. 22:42;"Vannak civil szervezetek. Nemcsak szocia패lisak, hanem a패llatve패delem, terme패szetve패delem, ko팯rnyezetve패delem stb-stb.
Az ezekne패l valo패 o팯nke패ntesse패gre gondoltam.";False;4190682
41;"Mit tudtok a Biztonsagpolitikai Szakkollegiumrol? Tagja itt
valaki neki? Mil, em kurzusok vannak? Milyen elonyokkel
(esetleg hatranyokkal jar a tagsag)? Mik az elvarasok a
tagok fele (pl. Kotelezo programok, tanulnivalok)?";['egyetem', 'felso팲oktata패s', 'szakkolle패gium', 'biztonsa패gpolitika', 'biztonsagpolitikai'];2014. szept. 29. 18:11;;True;6146620
42;Hogy mondja패k angolul azt, hogy szakkolle패gium?;;2011. dec. 1. 16:02;"Tudom, hogy a college e패s a dormitory/dorm az nagyja패bo패l ezt jelenti, de most felte패tlenu팯l pontos meghata패roza패sra lenne szu팯kse패gem! Ko팯szi elo팲re is a va패laszokat!
";True;2425632
43;;;2011. dec. 2. 16:08;Technical College;False;2425632
44;;;2011. dec. 3. 11:05;Ko팯szi sze패pen! Ma패r special college-t i패rtam:D Reme패lem nem lesz belo팲le ga패z.;False;2425632
45;;;2011. dec. 3. 11:08;"Hat sajnos akkor rosszat irtal.  Olyan nincs hogy ""special college"", vagy legalabbis nem utal a szakkollegiumra.";False;2425632
46;;;2011. dec. 4. 12:05;A패h, tu패le패lem:) Ko팯szi, megjegyzem, hogy hogy helyes!;False;2425632
47;;;2014. a패pr. 3. 20:55;"Ba패r nagyon uto패lag jo팯n a va패lasz, de az elso팲 va패lasz rossz volt.
A szakkolle패gium, ha arra gondolsz, hogy a szoka패sos tanterveken felu팯l me패g valamit hozza패ad plusz oktata패ske패nt egy felso팲oktata패sban tanulo패 dia패k tuda패sa패hoz (mint a Matthias Corvinus Coll, vagy Bibo패 SZakkoll,stb), akkor azt angolul College for Advanced Studies-nak szokta패k fordi패tani";False;2425632
48;"Budapestto팲l 2 o패ra패nyira lako패, minima패lbe패res szu팯lo팲k
egyke gyerekeke패nt mik lenne패nek a lakhata패si leheto팲se패gek
sza패momra? (SZTE-GYTK)";['kolle패gium', 'SZTE', 'Szegedi Tudoma패nyegyetem', 'Szegedi Egyetem', 'szakkolle패gium', 'SZTE-GYTK', 'gyo패gyszere패sztudoma패nyi kar gyo패gyszere패sz', 'o팯thalmi laka패s'];2012. dec. 25. 12:52;"Az albe패rlet kilo팲ve, azt nem tudna패nk fizetni sajnos.
Marad a szakkolle패gium (ha a Gyo패gyszere패sztudoma패nyi Karnak van egya패ltala패n, ezt nem tudom pontosan), az O팯thalmi Laka패sok e패s a kolle패gium, de nem tudom, ott milyenek a ko팯ru팯lme패nyek, mennyire lehet ott tanulni.

Mit aja패nlana패tok? Van ese패lyem bekeru팯lni valamelyikbe, vagy csak a na패lam ha패tra패nyos helyzetu팲bb dia패kok nyernek felve패telt?

Ko팯szi a segi패tse패get!  :)
";True;3795867
49;;['kolle패gium', 'SZTE', 'Szegedi Tudoma패nyegyetem', 'Szegedi Egyetem', 'szakkolle패gium', 'SZTE-GYTK', 'gyo패gyszere패sztudoma패nyi kar gyo패gyszere패sz', 'o팯thalmi laka패s'];2012. dec. 25. 12:59;"




 [link] 


ehhez szocia패lis helyzetfelme패ro팲 adatlapot kell kito팯lteni, ebbo팲l jo팯nni fog egy pontsza패m, e패s ez alapja패n fognak felvenni (hasonlo패 mint az egyetemi felve패teli).

nem tudom, h fel fognak e venni (e패n TTIK-s vagyok, ugye mi csak karko팯zi koleszokba mehetu팯nk).
nem akarok egy kolle패giumot se fika패zni, DE: arra figyelj, hogy az O팯thalmi Laka패soknak ke패t re패sze van, az egyik a csilli-villi (amit a neten rekla패moznak h nem re패g lett felu패ji패tva), a ma패sik a ""nem csilli-villi"" re패sz. e패s a csilli-villi re패szbe elso팲e패veseket nem vesznek fel.
de ha se a Semmelweis koli, se az O팯thalmi nem jo팯n o팯ssze, akk jelentkezz a Ka패rolyi koleszba (karko팯zi). az orsza패g legnagyobb kolle패giuma, 800 fo팲s. sok minden terjeng ro패la, h ele패g zu팯lo팯tt, nem lehet tanulni stb. de ez egya패ltala패n nem i패gy van. ha akarsz tanulni, akk u패gyis tanulni fogsz.";False;3795867
50;;['kolle패gium', 'SZTE', 'Szegedi Tudoma패nyegyetem', 'Szegedi Egyetem', 'szakkolle패gium', 'SZTE-GYTK', 'gyo패gyszere패sztudoma패nyi kar gyo패gyszere패sz', 'o팯thalmi laka패s'];2012. dec. 25. 13:01;"ui.: aze패rt aja패nlom a Ka패rolyit, mert:
1. e패n is oda ja패rok
2. nem vettek fel elso팲 ko팯rbe a Mo패ra koleszba, uta패na ro팯gto팯n felvettek a Ka패rolyiba (ele패g nagy a befogado패 ke패pesse패ge, oda fel fognak venni ele패g nagy valo패szi패nu팲se패ggel).";False;3795867
51;Ha패ny szakkolle패giumnak lehet egy dia패k egyszerre tagja?;['egyetem', 'tag', 'felso팲oktata패s', 'ELTE', 'ELTE-A패JK', 'szakkolle패gium'];2019. ju패l. 14. 12:30;"Nemigen tala패ltam va패laszt ra패 fo패rumokon (ha me패gis van, nagyon megko팯szo팯nne패m, ha belinkelne패tek), de felveto팲do팯tt bennem a ke패rde패s, miszerint adott esetben lehet-e pl. ke패t szakkolle패giumnak is tagja egy dia패k (amennyiben mindketto팲be felve패telt nyer, persze).

A va패laszokat elo팲re is ko팯szo팯no팯m!
";True;9984482
52;;['egyetem', 'tag', 'felso팲oktata패s', 'ELTE', 'ELTE-A패JK', 'szakkolle패gium'];2019. ju패l. 16. 08:48;"Szia!
Na패lunk a Corvinuson, ha az adott e패vben nem vettek fel oda ahova jelentkezte패l, akkor abban az e패vben ma패s szakkolle패giumokba ma패r a jelentkeze패sedet sem fogadja패k el. Szo패val ezek alapja패n e패n ki merne패m jelenteni, hogy egyszerrel legfeljebb egynek lehetsz a tagja.";False;9984482
53;;['egyetem', 'tag', 'felso팲oktata패s', 'ELTE', 'ELTE-A패JK', 'szakkolle패gium'];2019. ju패l. 23. 23:13;ELTE-A패JK-t la패tok a ci패mke패k ko팯zo팯tt, szo패val gondolom Bibo패 e패s Eo팯tvo팯s?? Tudtommal az Eo팯tvo팯st nem zavarja egya패ltala패n az ilyesmi.;False;9984482
54;;['egyetem', 'tag', 'felso팲oktata패s', 'ELTE', 'ELTE-A패JK', 'szakkolle패gium'];2019. ju패l. 25. 14:13;"Nagyon ko팯szo팯no팯m a va패laszokat, igen, az Eo팯tvo팯s e패s a Bibo패 e패rdekelne.

Elo팲bbi honlapja패n me패g szerepel is, hogy nem okoz proble패ma패t ma패s kolle패giumokkal fenna패llo패 tagsa패gi viszony, itt a Bibo패 az, amelyro팲l kevesebb info패 van fenn e tekintetben.";False;9984482
55;;['egyetem', 'tag', 'felso팲oktata패s', 'ELTE', 'ELTE-A패JK', 'szakkolle패gium'];2019. ju패l. 25. 17:26;Bocsi, a Bibo패t e패n sem tudom, Eo팯tvo팯s-Bolyais TTK-sokat ismerek.;False;9984482
56;"Mi a ve패leme패nyetek a SE Kora패nyi Frigyes Szakkolle패giumro패l
(Ha패rsfa)?";['Semmelweis', 'kolle패gium', 'Kora패nyi', 'ha패rsfa', 'szakkolle패gium'];2015. aug. 28. 21:53;"E패rdemes-e oda jelentkezni, jo패-e ott a ko팯zo팯sse패g, marad-e mellette szabadido팲?
";True;7163156
57;Hogy lehet bekeru팯lni a gyo팲ri Batthya패nyi Szakkole패giumba?;['egyetem', 'Sze패chenyi', 'szakkolle패gium'];2019. ju패l. 26. 21:52;"Milyen pontok sza패mi패tanak? Mikor van a felve패teli?
";True;10005724
58;"Mikor kell beko팯lto팯zni a magyarorsza패gi szakkolle패giumokba?
(Konkre패tan a pe패csi Ma패rton A패ron Szakkolle패gium
e패rdekelne)";;2018. ju패l. 10. 01:21;"Ku팯lfo팯ldro팲l megyek Magyarorsza패gra tanulni, eze패rt nem tudom pontosan, hogy mikor kell ezt megejteni. Annyiro팲l e패rtesu팯ltem, hogy a fe패le패v szeptember 3-a패n kezdo팲dik. Az elso팲 he패t ma패r rendes tani패ta패si he패t szokott lenni?
";True;9401159
59;"Szakkolle패gium szo패beli felve패telin milyen ke패rde패sek
vannak? Milyen te패ma패k keru팯lnek elo팲?";;2012. ju패l. 18. 23:51;;True;3208149
60;;;2012. ju패l. 19. 06:54;Atto패l fu팯gg, melyik szakkolle패giumba szeretne패l jelentkezni. Orvosi, fizikai, egye패b tudoma패nyos, esetleg valami ma패s? mert i패gy sokfe패le lehet :D;False;3208149
